,date,title,contents,label,sentiment
403,2020-11-17,"[SR사회공헌] 롯데하이마트, 사랑의열매와 '비대면 기부' 캠페인 진행",비대면 기부 캠페인 이미지 ⓒ롯데하이마트 - 동영상 '조회수' 1회당 100원 기부 롯데하이마트(대표 황영근)는 12월 11일까지 사랑의열매 사회복지공동모금회와 함께 유튜브 시청자 참여 기부 행사를 펼친다고 17일...,2,1
404,2020-11-17,"[기업] 롯데하이마트, 사랑의열매와 온라인 기부 캠페인",롯데하이마트가 다음 달 11일까지 사랑의열매와 유튜브 시청자 참여 기부 행사를 합니다. 사랑의 열매 유튜브 채널에서는 사회공헌 활동 하는 기업 제품을 소개하는데 이번에 소개하는 콘텐츠가 롯데하이마트 주방...,2,1
405,2020-11-23,"원톱' 신동빈의 첫 연말 인사…롯데, 임원 30% 물갈이?","신동빈 회장의 오른팔로 불렸던 황 전 부회장이 물러났고, 이동우 전 롯데하이마트 대표가 롯데지주 신임 대표로 선임됐다. 롯데하이마트, 롯데렌탈, 롯데물산, 롯데액셀러레이터 등 일부 계열사의 대표도 교체됐다....",3,1
406,2020-11-23,"신동빈 회장 '연말 인사'서 어떤 메시지 낼까...롯데, 26일 임원 인사",당시 롯데의 2인자로 불렸던 황각규 부회장이 실적부진의 책임을 지고 물러났고 이동우 롯데 하이마트 대표가 롯데지주로 자리를 옮겼다. 올해 1~3분기 롯데쇼핑의 영업이익은 1646억원으로 지난해 보다 57.2% 줄었다....,3,1
407,2020-11-23,"롯데, 26일 이사회…인적 쇄신으로 위기 돌파",신동빈 회장은 앞서 지난 8월 황각규 롯데지주 부회장의 사퇴를 수용하고 이동우 롯데하이마트 사장을 임명했다. 롯데렌탈과 롯데물산 등 일부 계열사 대표도 원포인트 인사로 교체됐다. 후속 인사도 진열 재정비를...,3,1
408,2020-11-23,"롯데, 연말 인사 이번주 단행…임원 30% 축소 대폭 물갈이",신 회장은 이미 지난 8월 이례적인 비정기인사를 통해 그룹 2인자였던 황각규 전 부회장을 퇴진시키고 이동우 롯데하이마트 사장을 롯데지주 신임 대표에 선임하는 쇄신을 단행했다. 또 지난달에는 롯데쇼핑 헤드쿼터(HQ)...,3,1
409,2020-11-25,"롯데하이마트, 독거노인에게 겨울 맞이 난방용품 세트 기증",롯데하이마트가 겨울을 맞아 추위에 취약한 독거노인에게 선물할 난방용품 세트 300여 개를 기증했다고 25일 밝혔다. 난방용품은 '어깨 팥 찜질기'와 자체상품(PB) '하이메이드 전기요'로 구성했다. 이날 기증식(사진)은...,2,1
410,2020-11-25,[유통단신] 롯데百·현대百·코웨이·KT&G·롯데하이마트,"◇ 롯데하이마트, 독거노인에 겨울 맞이 난방용품 세트 기증 롯데하이마트가 겨울을 맞아 추위에 취약한 독거노인에게 선물할 난방용품 세트 300여개를 기증한다. 난방용품은 ‘어깨 팥 찜질기’와 자체상품(PB)...",2,1
411,2020-11-25,"하이마트, 독거노인에 겨울나기 용품 기증",롯데하이마트(대표 황영근)는 25일 겨울을 맞아 추위에 취약한 독거노인에게 선물할 난방용품 세트 300여 개를 기증하기로 했다. 난방용품은 ‘어깨 팥 찜질기’와 자체상품 ‘하이메이드 전기요’로 구성했다. 서울...,2,1
412,2020-11-25,"롯데하이마트, 독거노인에게 겨울 맞이 난방용품 세트 기증","롯데하이마트(대표 황영근)가 겨울을 맞아, 25일 추위에 취약한 독거노인에게 선물할 난방용품 세트 3백여 개를 기증한다. 난방용품은 '어깨 팥 찜질기'와 자체상품(PB) '하이메이드 전기요'로 구성한다. 이날 기증식은...",2,1
413,2020-11-25,"롯데하이마트, 독거노인에 난방용품 세트 기증",롯데하이마트가 겨울을 맞아 추위에 취약한 독거노인에게 선물할 난방용품 세트 3백여 개를 기증합니다. 난방용품은 ‘어깨 팥 찜질기’와 자체상품‘하이메이드 전기요’로 구성됐습니다. 기증식은 서울 영등포구에...,2,1
414,2020-11-25,"[가전오늘] 코웨이 환경기술연구소, 국제숙련도 평가서 적합 판정…롯데하이마...","롯데하이마트, 독거노인에 겨울 맞이 난방용품 세트 기증 롯데하이마트는 겨울을 맞아 25일 추위에 취약한 독거노인에게 선물할 난방용품 세트 300여 개를 기증한다고 밝혔다. 난방용품은 '어깨 팥 찜질기'와 자체상품...",2,1
415,2020-11-25,"[오늘의 전자 단신] HP, '엔지니어링 에미상' 수상 外","◆롯데하이마트, 독거노인에게 전달할 난방용품 기증식 진행 롯데하이마트가 겨울을 맞아 추위에 취약한 독거노인에게 난방용품 세트 300여 개를 기증했다. 난방용품 세트는 '어깨 팥 찜질기'와 자체상품(PB)...",2,1
416,2020-11-25,"[SR사회공헌] 롯데하이마트, 겨울 맞이 '난방용품 세트' 기증",문병철 롯데하이마트 상품총괄부문장(사진 왼쪽)과 김현미 독거노인종합지원센터 센터장이 참석한 가운데 기념촬영을 진행했다. ⓒ롯데하이마트 - 전국 15개 농어촌 지역 독거노인 300여 명에게 전달 롯데하이마트(대표...,2,1
417,2020-11-25,"롯데하이마트, 독거노인 위한 난방용품 세트 기증",롯데하이마트(대표 황영근)는 25일 영등포구 독거노인종합지원센터를 통해 전국 15개 농어촌 지역 독거노인에게 ‘어깨 팥 찜질기’와 자체상품(PB) ‘하이메이드 전기요’로 구성된 난방용품 세트 300여개를 기증한다....,2,1
418,2020-11-26,"유통업계, 연말 맞아 따뜻한 손길 줄이어","롯데하이마트는 12월5일 ‘Hi(하이) 과학콘서트’를 연다. Hi 과학콘서트는 롯데하이마트가 2019년부터 진행해온 사회공헌활동이다. 전국 초·중학생 과학 꿈나무들이 일상 생활에서 쉽게 접하는 TV, 냉장고 등 가전...",2,1
419,2020-11-26,"롯데하이마트, 과학 꿈나무들을 위한 온라인 'Hi(하이) 과학콘서트' 개최",롯데하이마트(대표 황영근)가 12월 5일 'Hi(하이) 과학콘서트'를 연다. 'Hi(하이) 과학콘서트'는 롯데하이마트가 2019년부터 진행해온 사회공헌활동이다. 전국 초·중학생 과학 꿈나무들이 일상 생활에서 쉽게 접하는 TV...,2,1
420,2020-11-26,"[SR사회공헌] 롯데하이마트, 온라인 '하이 과학콘서트' 개최",온라인 하이 과학콘서트 개최 포스터 ⓒ롯데하이마트 - 사전 등록 참여자에게 다양한 혜택과 이벤트 제공 롯데하이마트(대표 황영근)는 12월 5일 'Hi(하이) 과학콘서트'를 연다고 26일 밝혔다. 'Hi(하이) 과학콘서트'는...,2,1
421,2020-11-30,"공정위, 롯데마트-슈퍼-하이마트 납품업체 종업원 부당 사용 '고무줄 과징금'...",하지만 공정위가 올해 10월 롯데슈퍼에 이어 제재 수위 발표가 12월 3일로 한 주일 연기된 롯데하이마트의 경우 솜방망이 과징금을 산정했다는 논란이 불가피할 전망이다. 이에 대해 공정위는 과징금 산정 방식에 따른...,2,0
422,2020-12-02,롯데하이마트 ‘납품 갑질’ 과징금 10억,"납품업체에서 파견받은 직원들에게 ‘다른 납품업체 제품 판매’ 등 부당한 업무를 시키고, 사전에 약정하지 않은 판매장려금 180억원을 거둔 롯데하이마트가 공정거래위원회 제재를 받는다. 공정위는 전자제품...",2,0
423,2020-12-02,‘갑질 백화점’ 하이마트…머쓱해진 회장님 신년사,"[리포트] 국내 최대 전자제품 전문점 롯데하이마트. 판매사원들은 하이마트 직원이 아니라 대부분 납품업체 소속입니다. 그러나 자사 제품만이 아니라 경쟁회사 제품까지 팔아야 했습니다. [전직 판매사원 : ""A회사여도...",2,0
424,2020-12-02,"업체 직원에 ""경쟁사 것도 팔라"" 갑질…하이마트 10억 과징금",가전판매점인 롯데하이마트가 납품 업체에 갑질을 한 혐의로 10억 원의 과징금을 물게 됐습니다. 납품 업체에서 보낸 직원을 자기네 직원처럼 부렸습니다. 쿠첸 직원을 불러서 밥솥 코너를 맡기고 고객이 쿠쿠나 다른...,2,0
425,2020-12-02,"""납품업체 직원 부리고 회식비 걷어""…하이마트 '과징금 10억'","국내 최대 전자제품 판매업체인 롯데하이마트에서 벌어진 일입니다. 이병주 기자의 보도입니다. 【 기자 】 연매출 4조 원 이상으로, 시장 점유율이 40%에 달하는 국내 최대 전자제품 판매 업체인 롯데하이마트....",2,0
426,2020-12-02,하이마트의 갑질…납품업체 직원에 화장실 청소까지,"롯데하이마트에 파견 나가서, 자기네 밥솥이 아닌 다른 제품을 팔아야 했다고 털어놓습니다. [파견 직원 A씨] (영상 : 까레라이스TV) ""(하이마트) 지점장님 말(지시)을 들어야 하는데, 지점장님은 제게 월급을 주지 않는...",2,0
427,2020-12-02,"[핫키워드5] 소녀상 영구화, 한류제품 인기, 하이마트 갑질, 조두순 방지법, ...","다음은 '롯데하이마트 갑질'입니다. 여러 '갑질' 논란을 일으킨 롯데가 또다시 '갑질'로 공정거래위원회의 제재를 받았습니다. 이번엔 롯데하이마트인데요, 납품업체 직원 1만4천여 명을 데려와 다른 회사 제품까지 팔게...",2,0
428,2020-12-02,"공정위, 납품업체 갑질한 롯데하이마트에 과징금 10억원","가전 양판점시장 1위 사업자 롯데하이마트가 납품업체로부터 부당하게 돈을 수취해 자신들의 지점 회식비, 영업사원 시상금 등에 쓰는 갑질행위를 하다가 공정거래위원회에 적발됐다. 2일 공정위는 롯데하이마트의...",2,0
429,2020-12-02,계속된 공정위 제재에도 멈추지 않는 롯데 '갑질',"지난 10월 롯데슈퍼가 납품업체를 상대로 ‘갑질’을 했다는 사실이 알려진 것에 이어, 이번엔 롯데하이마트의 ‘갑질’ 소식이 전해지면서 롯데유통계열사들이 가지고 있는 ‘갑질 관행’에 대한 지적을 피할 수...",2,0
430,2020-12-02,"롯데하이마트, 납품업체에 판매·회식비 강요","공정거래위원회가 납품업체 파견직원에게 타업체 상품 판매, 회식비 등을 강요한 롯데하이마트에 과징금 총 10억원을 부과하기로 결정했습니다. 하이마트는 납품업체 파견직원에 제휴계약이 돼 있는 카드발급, 이동통신...",2,0
431,2020-12-02,납품업체 직원에 청소까지…롯데하이마트 ‘갑질’ 공정위 제재,[리포트] 롯데하이마트는 지난 2015년부터 3년여 동안 31개 납품업체로부터 모두 만 4천여 명의 종업원을 파견 받았습니다. 인건비는 납품업체 부담. 하지만 업무는 사실상 하이마트의 직원이나 다를바 없었습니다. 매장...,2,0
432,2020-12-03,쿠첸' 직원에게 '쿠쿠' 판매 강요…갑질해서 난리난 하이마트 상황,공정거래위원회는 지난 2일 납품업체 종업원을 자신의 직원처럼 부린 롯데하이마트에 시정명령과 과징금 10억원을 부과한다고 밝혔는데요.공정위에 따르면 하이마트는 납품업자가 인건비를 모두 부담하는 조건으로...,2,0
433,2020-12-03,"갑질' 롯데하이마트, 공정위에 철퇴",납품업체 직원 대상 갑질행위 일삼아…과징금 10억원 롯데하이마트가 공정거래위원회발 철퇴를 맞았다. 납품 업체 종업원에게 '갑질'을 했다는 이유에서다. 공정위는 지난 2일 롯데하이마트의 대규모유통업법 위반...,2,0
434,2020-12-04,[주간브리핑] 2020년 12월 4일,"‘갑질온상’ 롯데하이마트, 과징금 10억…터질게 터졌다 롯데하이마트가 ‘갑질’을 일삼았다가 공정거래위원회로부터 대규모유통업법 위반행위에 대해 시정명령 및 과징금 10억원을 부과 받게 됐습니다. 이들은...",2,0
435,2020-12-04,"[이슈포커스] ‘갑질온상’ 롯데하이마트, 과징금 10억…터질게 터졌다",롯데하이마트가 ‘갑질’을 일삼았다가 공정거래위원회로부터 대규모유통업법 위반행위에 대해 시정명령 및 과징금 10억원을 부과 받게 됐습니다. 이들은 납품업체 종업원을 마치 자사 직원처럼 부리며 업무에...,2,0
436,2020-12-04,[금일 유통업계 주요기사] 모더나 VS 화이자 유통 승자는?...中 타오바오·티...,가전제품 양판점 롯데하이마트가 납품업체로부터 160억원을 부당하게 받아 지점 회식비 등으로 쓰다가 공정거래위원회에 적발됐다. 미국 바이오업체 모더나가 개발한 신종 코로나바이러스 감염증(코로나19) 백신이...,2,0
437,2020-12-07,구설수 롯데 왜 이러나?…빛바랜 쇄신인사,"롯데하이마트는 파견직원에 대해 갑질이 적발돼 집중관리 대상으로 지정, 체면을 구겼습니다. [박민규 / 안팍 법률사무소 대표 : 파견직원은 회사의 부당한 요구에 목소리를 내기 쉽지 않은데요. 대규모 파견 인력을...",2,0
438,2020-12-08,"[홈쇼핑 2.0] 재승인 앞둔 롯데, 中企 상생실적 최우수","롯데마트와 롯데하이마트 등 롯데쇼핑 내 사업부문 및 자회사는 지난해와 올해 협력사에 대한 갑질 논란을 빚으며 공정거래위원회로부터 각각 412억원, 10억원의 과징금을 부과 받았다.",2,0
439,2020-12-09,안내견'부터 '직원 상대 갑질'까지···롯데 계열사 '어찌하오리까',▲롯데그룹 CF광고영상 일부 갈무리.(사진출처=롯데그룹CF중) 롯데그룹 계열사 롯데하이마트에서 대표이사가 직원들을 상대로 부당한 갑질을 하고 있다는 청와대 청원 게시판에 올라와 논란이 예상된다. 특히...,2,0
440,2020-12-15,"[비즈 이슈] 위기의 유통업계 대표 교체 '승부수'…키워드는 ""젊은 피‧조직 ...","당시 황각규 롯데지주 부회장이 용퇴하고, 롯데지주 신임 대표이사로 롯데하이마트 대표이사인 이동우 사장이 선임됐다. 이어 11월 임원인사에서는 600여명에 달하던 총 임원수를 20% 감축하면서 임원을 100여명 줄이는...",3,1
441,2020-12-17,[취재수첩] '상생' 보폭 넓히는 롯데하이마트,롯데./ 사진=연합뉴스 롯데하이마트가 대·중소기업·농어업협력재단과 '농·어촌상생협력기금' 출연 협약을 체결하는 등 상생의 보폭을 넓히고 있다. '농·어촌상생협력기금'은 대·중소기업·농어업협력재단에서 관리...,2,1
442,2020-12-18,상생기업'도 뒤에선 여전히 갑질…2020 공정위 제재 따져보니,"양호 등급을 받은 롯데하이마트는 판매 장려금 부당 수취, 납품업체 파견 종업원 부당 사용 등의 대규모유통업법 위반 행위로 과징금 10억 원을 부과받았다. 납품업체 80곳으로부터 부당하게 받아낸 183억 원을...",2,0
443,2020-12-21,"롯데하이마트 ‘하트라이브’, 중소 파트너사 상생 라이브 방송 진행","롯데하이마트가 중소 파트너사와 함께하는 동행 프로젝트 콘텐츠를 선보인다고 21일 밝혔다. 롯데하이마트는 21일, 라이브커머스 ‘하트라이브’에서 중소 파트너사와 함께하는 동행 프로젝트 콘텐츠를 선보인다. 이번...",2,1
444,2020-12-21,"롯데하이마트 '하트라이브', 중소 파트너사와 상생 라이브 방송 진행","롯데하이마트 라이브커머스 '하트라이브'에서 21일, 중소 파트너사와 함께하는 동행 프로젝트 콘텐츠를 선보인다. 중소 파트너사 판로 개척을 지원하기 위한 동행 프로젝트로, 이번에는 '프로젝트슬립'과 '제스파...",2,1
445,2020-12-21,"롯데하이마트 '하트라이브', 중소 파트너사와 상생 라이브 방송 진행 ","/제공=롯데하이마트 롯데하이마트(대표 황영근) 라이브커머스 '하트라이브'에서 21일, 중소 파트너사와 함께하는 동행 프로젝트 콘텐츠를 선보인다. 이번 동행 프로젝트는 4회차로, 파트너사 임직원이 직접 콘텐츠를...",2,1
446,2020-12-21,"롯데하이마트 '하트라이브', 중소 파트너사와 상생 라이브 방송 진행","롯데하이마트(대표 황영근) 라이브커머스 '하트라이브'에서 21일, 중소 파트너사와 함께하는 동행 프로젝트 콘텐츠를 선보인다. 이번 동행 프로젝트는 4회차로, 파트너사 임직원이 직접 콘텐츠를 기획하고 출연해 제품을...",2,1
447,2020-12-21,"롯데하이마트 '하트라이브', 중소 파트너사와 상생 라이브 방송 진행",롯데하이마트가 중소 파트너사와 동행에 나섰다. (사진제공=롯데하이마트) 롯데하이마트(대표 황영근)가 라이브커머스 '하트라이브'에서 21일 중소 파트너사와 함께하는 동행 프로젝트 콘텐츠를 선보인다고 밝혔다. 이번...,2,1
448,2020-12-21,"[오늘의 전자 단신] SK매직, 일자리창출 공로 '은탑산업훈장' 수상 外","◆롯데하이마트, 중소 파트너사와 상생 라이브 방송 선봬 롯데하이마트가 21일 라이브커머스 '하트라이브'에서 중소 파트너사와 함께하는 동행 프로젝트 콘텐츠를 선보인다. 이번 동행 프로젝트는 4회차로, 파트너사...",2,1
449,2020-12-31,"공정위, 그룹사 부당지원한 롯데 제재 착수",공정위는 2020년 12월 롯데하이마트의 대규모유통업법 위반 행위에 대해 시정 명령과 함께 과징금 10억 원을 부과한 데 이어 2020년 초에는 롯데마트의 대규모유통업법 위반과 관련해 과징금 408억 원을 부과하기도...,2,0
450,2021-01-04,"롯데하이마트, 여성과 아동을 응원하는 'mom편한 하이드림(Hi Dream)' 진행","롯데하이마트(대표 황영근)가 2021년 첫 사회공헌 활동 'mom편한 하이드림(Hi-Dream)'을 진행한다. 엄마와 아이가 서로의 꿈을 응원하는 사연을 받아, 꿈을 이루는 데에 도움을 주는 가전제품을 선물하는 릴레이...",2,1
451,2021-01-04,"롯데하이마트, 여성·아동 응원 'mom편한 하이드림(Hi Dream)' 진행","롯데하이마트(대표 황영근)가 2021년 첫 사회공헌 활동 'mom편한 하이드림(Hi-Dream)'을 진행한다. 엄마와 아이가 서로의 꿈을 응원하는 사연을 받아, 꿈을 이루는 데에 도움을 주는 가전제품을 선물하는 릴레이...",2,1
452,2021-01-04,"[SR사회공헌] 롯데하이마트, '맘편한 하이드림' 진행",맘편한 하이드림 안내 이미지 ⓒ롯데하이마트 - 연간 6회 진행 예정 롯데하이마트(대표 황영근)는 2021년 첫 사회공헌 활동 '맘편한 하이드림'을 진행한다고 4일 밝혔다. 엄마와 아이가 서로의 꿈을 응원하는 사연을 받아...,2,1
453,2021-01-04,"[오늘의 전자 단신] 아이클레보, '세계일류상품' 10년 연속 선정 外","◆롯데하이마트, '맘편한 하이드림' 진행 롯데하이마트가 2021년 첫 사회공헌 활동으로 '맘(mom)편한 하이드림(Hi-Dream)'을 진행한다. '맘편한 하이드림'은 엄마와 아이가 서로의 꿈을 응원하는 사연을 받고, 꿈을 이루는...",2,1
454,2021-01-13,"롯데하이마트, 코로나19 결식아동에 세이프박스 지원","롯데하이마트가 코로나19 사태로 인해 돌봄 사각지대에 놓인 전국 6개 지역 아동 600명을 지원합니다. 식품과 방역 용품으로 구성한 총 3천만원 상당의 세이프박스를 전달하는데, 기증식은 서울 강남구에 위치한...",2,1
455,2021-01-13,[에너지경제신문 오프라인] 먼저 만나는 에너지경제신문 헤드라인 - 1월 14일,"어가 돕기 밀키트 판매하이트진로, 청년 자립의 꿈 실현 돕는다잇츠한불, 지역사회에 1억5천만원 상당 화장품 기부롯데하이마트, 지역아동에 3천만원 지원카카오커머스, 친환경 프로젝트 병뚜껑 보내면 키링 선물",2,1
456,2021-01-13,"롯데하이마트, 코로나19 결식아동 위한 세이프박스 지원","롯데하이마트(대표 황영근)가 13일, 코로나19 사태로 인해 돌봄 사각지대에 놓인 전국 6개 지역 아동 600명을 지원한다. 식품과 방역 용품으로 구성한 총 3천만원 상당의 세이프박스를 전달한다. 이날 기증식은 서울...",2,1
457,2021-01-13,[브리핑] 이마트24·롯데하이마트·CU·롯데백화점,"◇롯데하이마트, 결식 우려 아동에 세이프박스 지원 롯데하이마트는 전국 6개 지역 아동 600명에게 총 3000만원 상당의 ‘세이프박스’를 전달한다고 13일 밝혔다. 이번 행사는 코로나19 여파로 돌봄 사각지대에 놓인...",2,1
458,2021-01-21,2021 소비자가 뽑은 가장 신뢰하는 브랜드대상 유통·건설·지자체 부문 소개,가전 구매·주기적 관리 결합한 ‘가전 케어십’선보여 롯데하이마트 | 전자제품전문점 부문 롯데하이마트는 국내 1위의 전자제품 유통 전문기업으로 전국 440여 개 오프라인 매장과 온라인쇼핑몰을 운영하고 있다....,3,1
459,2021-01-21,"[더벨]롯데하이마트, 1년만에 곳간지기 교체…'재무통' 구원투수 급파",롯데하이마트 최고재무책임자(CFO)가 1년만에 교체됐다. 롯데지주 재무혁신실에서 재무1팀장을 맡았던 박상윤 상무가 롯데하이마트의 새 곳간지기를 맡는다. 박 신임 CFO는 최근 실적이 크게 악화 되는 등 어려운...,3,1
460,2021-01-22,"롯데하이마트, 공정위 경고 조치…전자상거래보호법 위반",21일 공정거래위원회(공정위)에 따르면 롯데하이마트는 지난 13일 전자상거래소비자보호법 위반 행위로 '경고' 조치를 받았다. ⓒ롯데하이마트 CI 지난해 협력업체 갑질로 곤욕을 치렀던 롯데하이마트가 올해에는...,2,0
461,2021-01-25,신동빈 강조한 'ESG 경영'…롯데 계열사 성적표는,"롯데제과와 롯데하이마트도 통합 A등급으로 선방했다. 다만 롯데제과는 지배구조에서, 롯데하이마트는 환경 영역에서 B+등급으로 개선이 필요하다는 평가를 받았다. 롯데정보통신과 롯데케미칼도 환경을 제외한...",1,0
462,2021-01-26,"만성 갑질' 롯데하이마트, 지점장 부당발령에 자살…'회사는 승승장구?'","""저성과자 낙인찍어 폐기물 처리하듯이 내버려…부당행위 근절돼야"" '대답 않는' 롯데하이마트…협력업체 갑질로도 공정위 '철퇴' 만성적인 '갑질'로 공정거래위원회(공정위) 철퇴를 맞은 롯데하이마트가 매장 지점장에...",2,0
463,2021-01-28,롯데하이마트 '묻지마' 지방 발령…'갑질'에 거리로 나선 지점장들,일방적 매장 폐점‧지방발령…기준도 예고도 없어 롯데하이마트의 원칙도 없는 '묻지마' 인사조치로 전국 롯데하이마트 지점장들은 생존권이 위협 받고 있다. 지난 23일 청와대 국민청원게시판에는 롯데하이마트의...,2,0
464,2021-02-03,"롯데하이마트, 사랑의열매와 함께 보호 종료 아동 자립 지원","롯데하이마트(대표 황영근)가 3일, 올해 성인이 된 보호 종료 아동 5명에게 사회 진출 격려를 위한 자립지원금 1천만원을 후원한다. 보호 종료 아동은 아동복지법상 만 18세가 되어 보육 시설에서 퇴소해야 하는 청소년을...",2,1
465,2021-02-03,"[SR사회공헌] 롯데하이마트, 보호 종료 아동 자립 지원","롯데하이마트는 보호 종료 아동들이 사회에 나와 맞이하는 처음 1년간 매월 일정 금액을 지원한다. ⓒ롯데하이마트 - 자립지원금 1,000만원 후원 롯데하이마트(대표 황영근)는 올해 성인이 된 보호 종료 아동 5명에게 사회...",2,1
466,2021-02-03,"""롯데하이마트"" 사랑의열매와 함께 보호 종료 아동 자립 지원 주목","롯데하이마트가 3일, 올해 성인이 된 보호 종료 아동 5명에게 사회 진출 격려를 위한 자립지원금 1천만원을 후원한다. 보호 종료 아동은 아동복지법상 만 18세가 되어 보육 시설에서 퇴소해야 하는 청소년을 뜻한다....",2,1
467,2021-02-03,"롯데하이마트, 보호 종료 아동 자립 지원",롯데하이마트가 올해 성인이 된 보호 종료 아동 5명에게 사회 진출 격려를 위한 자립지원금 1000만원을 후원한다. 보호 종료 아동은 아동복지법상 만 18세가 되어 보육 시설에서 퇴소해야 하는 청소년을 뜻한다....,2,1
468,2021-02-03,"롯데하이마트, 사랑의열매와 보호종료아동에 1천만원 후원",롯데하이마트가 올해 성인이 된 보호 종료 아동 5명에게 사회 진출 격려를 위한 자립지원금 1천만원을 후원한다고 3일 밝혔다. 보호 종료 아동은 아동복지법상 만 18세가 되어 보육 시설에서 퇴소해야 하는 청소년을 뜻한다....,2,1
