,date,title,contents,label
2303,2020-12-29,"유통주 갈피 못 잡아, GS홈쇼핑 4%대 BGF리테일 3%대 떨어져","BGF리테일 주가는 3.26%(4500원) 떨어진 13만3500원에, 현대홈쇼핑 주가는 1.45%(1200원) 낮아진 8만1400원에, GS리테일 주가는 0.87%(300원) 내린 3만4350원에 장을 끝냈다. 반면 엔에스쇼핑 주가는 0.84%(100원) 높아진...",0
2304,2020-12-29,동반성장위 '혁신주도형 임금격차 해소' 동반성장 협약 체결,동반성장위원회는 올해 현대홈쇼핑을 비롯해 17개 대기업·중견기업·공기업과 '혁신주도형 임금격차 해소 협약'을 체결했다고 29일 밝혔다. 동반성장위는 대기업과 중소기업의 양극화 해소를 위해 지난 2018년부터...,2
2305,2020-12-29,"결혼정보회사 듀오, '소비자중심경영' 4회 연속 인증 획득해","한편, 이번 연도에 CCM 재인증 및 신규인증을 획득한 기업으로는 ㈜대한항공, 코카-콜라음료㈜, ㈜현대홈쇼핑, 하나카드㈜, 풀무원건강생활㈜ 등이 있다. 듀오는 결혼정보업계에서 유일하게 CCM 인증기업으로...",6
2306,2020-12-29,"""올해 안쓰면 소멸""…연말 이통사 멤버십 혜택 A to Z",KT는 VIP 기준으로 △롯데ON 5000원 할인 쿠폰 △K쇼핑 7000원 할인 △G마켓 3000원 중복쿠폰 2매 △인터파크 도서 2000원 도서상품권 △랄라블라·롭스 온라인몰 각각 5000원·3000원 할인쿠폰 △ 현대 Hmall 홈쇼핑 방송상품...,0
2307,2020-12-29,“‘갓튜브’ 잡아라”…통신사도 뛰어든 ‘라이브 커머스’ 춘추전국시대,직장인 A씨는 28일 오후 6시쯤 현대홈쇼핑에서 판매한 ‘라 사본느리 비누’ 라이브 방송을 보고 비누를 구입했다. TV나 홈쇼핑 채널이 아닌 KT의 온라인 동영상 서비스(OTT)인 ‘시즌’을 통해서다. A씨는 채팅창을 통해...,0
2308,2020-12-29,"동반성장위, 올해 17개 기업과 '임금격차 해소' 협약···""누적 67곳""",(사진=동반성장위원회) 동반성장위원회는 올해 현대홈쇼핑 등 17개 대기업·중견기업·공기업과 '혁신주도형 임금격차 해소 협약'을 체결했다고 29일 밝혔다. 협약 체결 기업은 모두 67곳으로 늘었다. 동반성장위는...,2
2309,2020-12-30,"유한건강생활 에스트리션 '백수오 퓨어', 홈쇼핑 매진 기염","이번 현대홈쇼핑 방송에서는 대표 제품인 '에스트리션 백수오 퓨어' 3개월 분 과 6개월 분을 각각 18만9000원, 34만9000원의 정가 대비 최대 33%까지 할인 가격에 선보였으며 생방송 중 준비 물량이 조기 매진되는 기록을...",0
2310,2020-12-30,"온라인시장, 이커머스에서 '라이브커머스'로 급속 진화中","KT는 현대홈쇼핑, GS홈쇼핑 양사와 제휴해 쇼핑라이브 서비스를 시작했다고 밝혔다. 내년 중 신세계TV쇼핑, KTH 등 T커머스와 콘텐츠 제휴도 논의 중이다. 향후 홈쇼핑사와 협력에 커머스 콘텐츠를 공동 제작하고, 시즌...",0
2311,2020-12-30,온택트 최대 수혜 '라이브커머스' 통신사도 가세,특히 KT는 현대홈쇼핑·GS홈쇼핑 등 국내 홈쇼핑업계와 제휴해 이번 서비스를 내놨다. 홈쇼핑의 장점과 라이브커머스 이점이 결합돼 높은 시너지 효과를 낼 것으로 기대된다. 오는 2021년 중 신세계TV쇼핑 등 T커머스와...,0
2312,2020-12-30,"'그란츠 치약' 현대홈쇼핑 단독 런칭, 고객들 3차 앵콜 방송 요청","현대홈쇼핑 관계자는 ""지금처럼 코로나19로 인해 마스크를 장시간 착용해야 하는 시기일수록 구강건강과 구취 케어를 위한 생활 필수품인 좋은 치약 선택이 중요하다는 판단 하에 믿을 수 있는 생활 필수품인 그란츠...",0
2313,2020-12-30,"'가구 빅2' 궤도 오른 현대리바트, B2C 강화로 1위 넘본다",현대리바트는 현대홈쇼핑을 통해 현대리바트를 판매했고 현대백화점 입점도 확대했다. 현대백화점에 입점하면서 고급 브랜드라는 이미지도 함께 얻었다. 현대리바트는 현대백화점에 입점하면서 판로확대와 브랜드...,0
2314,2020-12-30,"유통주 대부분 올라, 신세계 2%대 호텔신라 BGF리테일 1%대 상승","엔에스쇼핑 주가는 0.41%(50원) 높아진 1만2100원에, 현대홈쇼핑 주가는 0.12%(100원) 오른 8만1500원에 거래를 마쳤다. 반면 GS홈쇼핑 주가는 0.29%(400원) 떨어진 13만9천 원에 장을 끝냈다. [비즈니스포스트 ]",0
2315,2020-12-30,[유통결산] 코로나와 동행 '2020 유통업계',"임대규 현대홈쇼핑 대표이사 사장(1961년생), 김관수 현대L&amp;C 대표이사 부사장(1963년생), 이재실 현대백화점면세점 대표이사 부사장(1962년생)이 각각 승진했다. CJ그룹도 주요 계열사의 대표를 교체했다. CJ제일제당...",3
2316,2020-12-30,신축년 유통업계 소띠 CEO 과제는…포스트 코로나 대비,올해 말 정기 임원인사에서 새로운 공동 대표이사에 선임된 임대규 현대홈쇼핑 대표도 1961년생이다. 현대홈쇼핑이 대표이사를 교체한 것은 6년만이다. 임 신임 대표는 1988년 현대백화점에 입사해 현대백화점...,0
2317,2020-12-30,"유한건강생활 ""여성 갱년기 케어 브랜드 홈쇼핑서 매진 기록""",유한건강생활은 여성 갱년기 건강 케어 전문 브랜드 에스트리션이 지난 29일 현대홈쇼핑에서 매진을 기록했다고 30일 밝혔다. 에스트리션은 국내 최초로 식품의약품안전처(이하 식약처)에서 갱년기 기능성을 인정받은...,0
2318,2020-12-30,"라방이 대세…홈쇼핑, 내년 볼륨 키운다","홈쇼핑 소외된 MZ세대 겨냥 현대홈쇼핑은 유튜브, 인스타그램, 페이스북 등 미디어 콘텐츠를 활용하는 미디어커머스 확대에 나선다. 우선 라이브 커머스 역량을 높인다. 현대홈쇼핑은 라이브 커머스 '쇼핑 라이브'의...",0
2319,2020-12-31,"현대홈쇼핑, 새해 맞아 '슈퍼 렌탈 원데이' 특집전",현대홈쇼핑은 2021년 1월3일 하루 동안 새해맞이 ‘슈퍼 렌탈 원데이’ 특집전을 진행한다고 31일 밝혔다. 이번 행사에서는 정수기·음식물 처리기·청정환기 시스템 등 렌탈 상품 5종을 각각 50~70분간 선보인다. 먼저...,0
2320,2020-12-31,'답 없는' 송출 수수료율…홈쇼핑 업계 '속앓이',지난해 10월 현대홈쇼핑은 LG유플러스와 송출 수수료 협상을 벌이다 결국 채널 10번을 내주고 30번대로 밀려났다. 2018년에는 롯데홈쇼핑이 수수료 갈등 끝에 KT의 올레TV 6번에서 30번대로 채널을 옮겼다. 홈쇼핑업계는...,0
2321,2020-12-31,(인사)신한생명,정종헌 △현대홈쇼핑 울산센터 센터장 유수정 △파슬 구리센터 센터장 김재순 △현대홈 미디어가산센터 센터장 최용길 △GS홈 미디어부평센터 센터장 김도훈 △신한 미디어을지로센터 센터장 최수한...,0
2322,2020-12-31,"[유통오늘] GS25, 롯데제과와 '말랑이 캐릭터' 활용 전략적 제휴…현대홈쇼핑...","현대홈쇼핑, 새해 맞아 '슈퍼 렌탈 원데이' 특집전 마련 현대홈쇼핑은 오는 1월 3일 하루 동안 새해맞이 '슈퍼 렌탈 원데이' 특집전을 진행한다고 31일 밝혔다. 이번 행사에서는 정수기·음식물 처리기·청정환기...",0
2323,2020-12-31,"현대홈쇼핑, 새해 맞아 '슈퍼 렌탈 원데이' 특집전 연다","현대홈쇼핑은 다음달 3일 하루 동안 새해맞이 '슈퍼 렌탈 원데이' 특집전을 진행한다고 31일 밝혔다. 이번 행사에서는 정수기·음식물 처리기·청정환기 시스템 등 렌탈 상품 5종을 각각 50~70분간 선보인다. 먼저, 오후 1시...",0
2324,2020-12-31,2021년 코로나로 달라진 새해 자기계발 '결심상품' 인기,현대홈쇼핑은 새해를 맞아 집에서도 운동과 공부를 즐길 수 있는 ‘새해 결심 상품’을 선보인다. 집에서도 쉽게 트레이닝이 가능한 ‘크로스엑스런 러닝머신’과 태블릿PC 기반의 스마트 영어학습 시스템 ‘뇌새김...,0
2325,2020-12-31,새해 결심하셨나요?…집에서 운동·영어 공부 등 자기계발 상품 할인 행사,"현대홈쇼핑은 오는 3일을 ‘슈퍼렌탈원데이’로 잡았는데, 집에서 달리기와 영어 공부를 할 수 있게 하는 ‘크로스엑스런 런닝머신(오후 5시45분)’과 ‘뇌새김 영어(오후 11시50분)’를 배치했다. 업체들이 새해 결심...",0
2326,2020-12-31,1월1일 인사,정종헌 △현대홈쇼핑 울산센터 유수정 △파슬 구리센터 김재순 △현대홈 미디어가산센터 최용길 △GS홈 미디어부평센터 김도훈 △신한미디어을지로센터 최수한 △경인고객플라자 김명환 △수원고객플라자 이성우...,0
2327,2020-12-31,"현대홈쇼핑, 새해 맞아 '슈퍼 렌탈 원데이' 특집전 편성",내년 1월 3일 '경동나비엔 청정환기시스템' 앵콜 방송 등 렌탈 상품 5개 특집 방송 편성 현대홈쇼핑은 다음달 3일 하루 동안 새해맞이 '슈퍼 렌탈 원데이' 특집전을 진행한다고 31일 밝혔다. 이번 행사에서는 정수기...,0
2328,2020-12-31,"현대홈쇼핑, 내달 3일 단 하루 '슈퍼 렌탈 원데이' 특집전",사진= 현대홈쇼핑 제공 ?현대홈쇼핑이 다음달 3일 하루 동안 새해맞이 '슈퍼 렌탈 원데이' 특집전을 진행한다. 이번 행사에서는 정수기·음식물 처리기·청정환기 시스템 등 렌탈 상품 5종을 각각 50~70분간 선보인다. 먼저...,0
2329,2021-01-01,"'신축년' 맞은 유통업계 '소띠'CEO들, 위기극복·신성장동력 확보 이끈다",올해 말 정기 임원인사에서 새로운 공동 대표이사에 선임된 임대규 현대홈쇼핑 대표도 1961년생이다. 현대홈쇼핑이 대표이사를 교체한 것은 6년만이다. 임 대표는 1988년 현대백화점에 입사해 현대백화점...,0
2330,2021-01-01,[경제계 인사]한국투자공사 外,정종헌 △현대홈쇼핑 울산〃 유수정 △파슬 구리〃 김재순 △현대홈 미디어가산〃 최용길 △GS홈 미디어부평〃 김도훈 △신한 미디어을지로〃 최수한 △경인고객플라자〃 김명환 △수원고객플라자〃 이성우...,0
2331,2021-01-01,"[유통톡톡] '라방'에 빠진 유통업계... ""재미·정보·소통 삼박자 갖춰야""",(현대홈쇼핑 제공)/그린포스트코리아 업계 불문 사회 전반적으로 실시간 동영상 스트리밍으로 소통을 하는 라이브커머스가 인기다. 연예인들도 더 이상 TV예능이 아닌 V앱을 통한 소통을 선호하고 있다. 1020소비자들은...,0
2332,2021-01-01,"합병 준비하고, 구원투수 등판하고…유통업계 소띠 CEO",1961년생인 임대규 현대홈쇼핑 대표이사도 소띠 경영인이다. 지난해 11월 정기 임원 인사에서 승진 발탁된 임 대표는 현대홈쇼핑이 6년 만에 새 대표를 내세우면서 발탁한 인물이다. 1988년 현대백화점에 입사해...,0
2333,2021-01-01,"[소띠 경영인] 허연수 GS리테일 부회장…""합병으로 포스트코로나 큰 그림""","한편 유통업계 소띠 경영인으로는 허연수 GS리테일 부회장을 비롯해 김호성 GS홈쇼핑 대표(1961년생), 임대규 현대홈쇼핑 대표(1961년생), 이필재 KTH 대표(1961년생), 구창근 CJ올리브영 대표(1973년생), 김창수 F&amp;F 대표...",0
2334,2021-01-04,"현대百, 뷰티·헬스케어 미래 먹거리로 키운다","e커머스 시대의 핵심 계열사로 떠오른 현대홈쇼핑은 방송 상품 중심 전문몰과 패션·뷰티 전문몰 구축, 패션·뷰티·건강기능식품 사업 진출도 검토한다. 적자 폭을 줄인 면세점 역시 고삐를 죈다. ‘글로벌 톱10 면세점...",0
2335,2021-01-04,"현대백화점그룹, ‘비전2030’ 발표…매출 40조 시대 열 청사진",현대홈쇼핑은 온라인 판매채널을 보완하고 상품력 강화를 위해 유관 사업에 진출합니다. 방송 상품 중심 전문몰 구축과 미디오 커머스 강화 및 패션·뷰티 전문몰 출시를 검토하고 있습니다. 또한 패션·뷰티 및...,0
2336,2021-01-04,"정지선 현대백화점그룹 비전 2030 제시, ""매출 40조시대 연다""",현대홈쇼핑은 온라인 판매채널을 보완하고 상품력을 강화하기 위해 관련 사업에 진출한다. 방송상품 중심 전문몰과 패션·뷰티 전문몰을 구축하고 패션·뷰티·건강기능식품사업에도 진출한다. 현대백화점면세점은...,0
2337,2021-01-04,현대百 매출 40조 시대 연다… 유통·패션·리빙 3대 핵심사업에 집중,현대홈쇼핑은 방송 상품 중심의 전문몰 구축을 비롯래 미디어 커머스 강화와 패션·뷰티 전문몰 론칭을 검토하고 있다. 패션·뷰티 및 건강기능식품 브랜드 중심으로 사업 진출도 구상 중이다. 현대백화점면세점은...,0
2338,2021-01-04,창립 50년 현대백화점그룹 ‘비전 2030’‥“사회와 공동성장 통해 2030년 매...,"현대홈쇼핑의 경우 온라인 판매채널을 보완하고 상품력 강화를 위해 유관 사업에 진출할 예정이다. 이를 위해 방송 상품 중심의 전문몰 구축은 물론, 미디오 커머스 강화와 패션·뷰티 전문몰 론칭을 검토하고 있다....",0
2339,2021-01-04,"현대百의 고객동행 ""의식주 모두 책임질게요""",근처 현대백화점에 있는 헬스케어 스토어에서 예약해 놓은 정기 건강관리를 받은 후 집에 돌아온 이씨는 태블릿으로 현대홈쇼핑이 진행하는 라이브커머스를 시청하면서 한섬이 만든 기능성 마스크팩을 얼굴에 붙였다....,0
2340,2021-01-04,"정지선 현대백화점그룹 회장의 '공격경영'…""2030년 매출 40조 시대 연다""",현대홈쇼핑은 온라인 판매채널을 보완하고 상품력 강화를 위해 유관 사업에 진출하기로 했다. 이를 위해 방송 상품 중심의 전문몰을 구축하고 미디어 커머스 강화와 패션·뷰티 전문몰 론칭을 검토하고 있다. 패션...,0
2341,2021-01-04,현대백화점그룹 '비전 2030' 발표...매출 40조 시대 연다,현대홈쇼핑의 경우 온라인 판매채널을 보완하고 상품력 강화를 위해 유관 사업에 진출할 예정이다. 패션 부문은?한섬?고유의 프리미엄 이미지를 앞세운 새로운 패션 브랜드 론칭과 온·오프라인 유통 채널 확대에...,0
2342,2021-01-04,창립 50돌 현대百그룹 “2030년 매출 40조 달성”,"현대홈쇼핑 부문에서는 방송 상품 중심의 전문몰 구축, 미디어 커머스 강화, 패션·뷰티 전문몰 론칭을 검토하고 있다. 패션·뷰티 및 건강기능식품 브랜드 중심으로 사업 진출도 검토하고 있다. 현대백화점면세점은...",0
2343,2021-01-04,"정지선 현대百그룹 회장, '비전 2030' 발표…""매출 40조 시대 열겠다""","현대홈쇼핑의 경우 온라인 판매채널을 보완하고 상품력 강화를 위해 유관 사업에 진출할 예정이다. 이를 위해 방송 상품 중심의 전문몰 구축은 물론, 미디오 커머스 강화와 패션·뷰티 전문몰 론칭을 검토하고 있다. 또...",0
2344,2021-01-05,"""연임이냐 교체냐""…유통업계 사외이사 절반 임기 종료","롯데쇼핑, CJ ENM, 현대홈쇼핑도 임기 만료가 임박한 이사가 절반이나 된다. 반면 GS리테일, BGF리테일 등 편의점 업계는 올해 임기가 끝나는 이사가 단 1명도 없었다. 6년 임기를 꽉 채운 이사를 제외하면 평균 2~4년으로...",3
2345,2021-01-05,창립 50주년 맞은 현대백화점그룹… “2030년 매출 40조 목표”,"현대홈쇼핑 부분에서는 방송 상품 중심의 전문몰 구축, 미디어 커머스 강화, 패션·뷰티 전문몰 론칭을 검토하고 있다. 패션·뷰티 및 건강기능식품 브랜드 중심으로 사업 진출도 검토하고 있다. 현대백화점면세점은...",0
2346,2021-01-05,"홈쇼핑 브랜드평판 1월 빅데이터 분석 1위는 롯데홈쇼핑... 2위 현대홈쇼핑, ...","홈쇼핑 브랜드평판 2021년 1월 빅데이터 분석결과, 1위 롯데홈쇼핑 2위 현대홈쇼핑 3위 GS홈쇼핑 순으로 나타났다. 대한민국 TV홈쇼핑 시장을 이끌고 있는 TV홈쇼핑 브랜드인 현대홈쇼핑, GS홈쇼핑, CJ오쇼핑...",0
2347,2021-01-05,"현대백화점그룹 ""사회와 공동 성장 통해 2030년 매출 40조 시대 열겠다""","현대홈쇼핑의 경우 온라인 판매채널을 보완하고 상품력 강화를 위해 유관 사업에 진출할 예정이다. 이를 위해 방송 상품 중심의 전문몰 구축은 물론, 미디오 커머스 강화와 패션ㆍ뷰티 전문몰 론칭을 검토하고 있다....",0
2348,2021-01-05,“뷰티·헬스케어 진출해 10년뒤 매출 40조 시대 연다”,현대홈쇼핑은 방송 상품 중심으로 전문몰을 구축하는 한편 패션·뷰티 전문몰 론칭 등 패션·뷰티 및 건강기능식품 브랜드 중심으로 사업 진출을 검토 중이다. 현대백화점면세점은 ‘글로벌 톱10 면세점 진입’을...,0
2349,2021-01-05,"""10년 지속성장 방향성 담았다""…현대백화점그룹, 2030년 매출 40조 목표 비전...","현대홈쇼핑의 경우 온라인 판매채널을 보완하고 상품력 강화를 위해 유관 사업에 진출할 예정이다. 이를 위해 방송 상품 중심의 전문몰 구축은 물론, 미디오 커머스 강화와 패션·뷰티 전문몰 론칭을 검토하고 있다....",0
2350,2021-01-05,"알집매트, 7일 현대홈쇼핑서 '더블제로매트' 특가 방송",프리미엄 유아매트 전문 알집매트는 오는 7일 오후 1시 40분부터 1시간 동안 현대홈쇼핑에서 알집 더블제로매트 특가 방송을 진행한다. 알집 더블제로매트는 매트 2장이 필요한 공간을 한 장으로 깔끔하게 채울 수...,0
2351,2021-01-05,"정지선 현대백화점그룹 회장 ""2030년 매출 40조원 시대 열겠다""","현대홈쇼핑의 경우 온라인 판매채널을 보완하고 상품력 강화를 위해 유관 사업에 진출할 예정이다. 이를 위해 방송 상품 중심의 전문몰 구축은 물론, 미디오 커머스 강화와 패션·뷰티 전문몰 론칭을 검토하고 있다....",0
2352,2021-01-05,"현대백화점그룹, 2030년 매출 40조 시대 연다","유통부문 현 13조 매출 규모를 2030년 29조까지 확대 현대홈쇼핑의 경우 온라인 판매채널을 보완하고 상품력 강화를 위해 유관 사업에 진출할 예정이다. 이를 위해 방송 상품 중심의 전문몰 구축은 물론, 미디오 커머스...",0
2353,2021-01-05,"유통주 상승 많아, 엔에스쇼핑 7%대 GS리테일 2%대 올라",현대홈쇼핑 주가는 0.63%(500원) 높아진 8만 원에 거래를 끝냈다. 반면 GS홈쇼핑 주가는 0.07%(100원) 떨어진 13만8300원에 장을 마감했다. 호텔과 백화점기업 주가는 엇갈렸다. 현대백화점 주가는 2.78%(2천 원)...,0
2354,2021-01-06,50대 CEO·30대 임원… 젊어진 유통가 '새로운 길' 개척 나선다,"정지선 회장(48)이 이끄는 현대백화점그룹 역시 현대홈쇼핑, 현대L&amp;C, 현대백화점면세점, 에버다임 등 4개 계열사 신임대표를 모두 50대로 선임했다. 정 회장은 새해 경영 화두로 ‘고객의 본원적 가치’를 제시하며...",3
2355,2021-01-06,"""소처럼 우직하게""...유통街 새내기 소띠 CEO가 달린다","임대규 현대홈쇼핑 대표이사(사진 왼쪽), 김재천 AK플라자 대표이사. [사진=각사] 2021.01.05 nrd8120@newspim.com ◆새내기 소띠 CEO가 달린다...임대규·김재천, 경영 정상화에 '전력투구' 올해 새롭게 선임된 유통업계 수장...",3
2356,2021-01-06,"[빅데이터] 온라인쇼핑, '언택트' 성장 지속","9%를 차지한다. [표] 인터넷쇼핑 거래액 월별 추이 (자료: 아이투자 인더스트리워치) ※ 온라인·모바일 쇼핑 거래액 관련 종목 이마트, 롯데쇼핑, 신세계, 현대홈쇼핑, GS홈쇼핑, 예스24, 엔에스쇼핑, 다나와",0
2357,2021-01-06,"유통업계, 주목받는 소띠 CEO는 누구?","▲ 허연수 GS리테일 부사장(왼쪽부터), 임대규 현대홈쇼핑 대표, 우창균 신세계L&amp;B대표.[아시아타임즈=조광현 기자]?2021년 신축년(辛丑年) '흰 소의 해'를 맞아 유통업계 소띠 전문경영인(CEO)들이 주목받고 있다....",3
2358,2021-01-06,'상담전화 폭주' 없애 1만4000개 고객사 사로잡다,"쿠팡·SSG닷컴·현대홈쇼핑·하이마트·배달의민족 등 유통 분야부터 네이버·카카오 등 포털, 삼성증권·토스 등 금융, 밝은성모안과·아이디병원 등 의료, 모두투어·여기어때 등 여행에 이르기까지 기업·소비자 간 거래...",0
2359,2021-01-06,"유통주 갈피 못 잡아, 엔에스쇼핑 상승 현대홈쇼핑 현대백화점 하락","반면 현대홈쇼핑 주가는 1.63%(1300원) 하락한 7만8700원에 장을 종료했다. 호텔과 백화점기업 주가는 엇갈렸다. 호텔신라 우선주 주가는 0.62%(500원) 높아진 8만1400원에, 광주신세계 주가는 0.33%(500원) 오른...",0
2360,2021-01-06,"1인 가구 겨냥…""쌀 300g, 한끼 소고기도 배송""","현대홈쇼핑 역시 식품뿐 아니라 미용 상품도 반반 나눠 배달해주기로 했다. 한 달에 5만원을 내면 매일 빵을 배달해주는 신세계백화점은 올해 서비스 점포 수를 대폭 늘릴 방침이다. 쪼개 팔고, 나눠 배달해주는 ‘1~2인...",0
2361,2021-01-07,"정종철 ""폭설로 4시간 걸려 집도착..어디 나가지 말아라..상황이 좀 심각""","천호동 현대 홈쇼핑 마치고 서초동 집까지 4시간 걸려 도착해서 화장실에 앉아버렸어요""라고 적었다. 이어 ""르네상스 호텔 사거리 제 앞차 운전자분, 따님이랑 어쩔 줄 몰라 하시는데 별 도움도 못 드리고 저만 집에 온 거...",0
2362,2021-01-07,[이티에프] TIGER 200 경기소비재 ETF 급등....'현대모비스·한온시스템·롯데...,"현대백화점, 롯데쇼핑, 지누스, 영원무역, 세방전지, 금호타이어, 더블유게임즈, 롯데관광개발, 현대홈쇼핑, F&amp;F, GKL, 신셰계인터내셔날, S&amp;T모티브, 한섬, 한국테크롤로지그룹, 한세실업, 롯데하이마트...",0
2363,2021-01-07,"홈쇼핑업계, IPTV 사업자 눈치만... 송출수수료에 등골 휜다",지난해 10월 현대홈쇼핑은 LG유플러스와 송출 수수료로 법적 대응까지 나섰지만 결국 10번 채널에서 30번대로 밀렸다. 롯데홈쇼핑도 수수료 갈등 끝에 KT의 올레TV 6번에서 30번대로 옮겼다. 홈쇼핑 업계 관계자는...,0
2364,2021-01-07,"국민연금, 현대홈쇼핑 소량 확대...지분율 12.25%",국민연금공단(이하 국민연금)이 현대홈쇼핑의 지분을 소량 확대했다고 7일 공시했다. 이에 따르면 국민연금의 지분율은 지난해 9월 29일 11.77%에서 지난해 12월 31일 12.25%로 증가했다. 현대홈쇼핑은 홈쇼핑 업계...,0
2365,2021-01-07,"유통주 대부분 올라, 이마트 8%대 엔에스쇼핑 7%대 뛰어","엔에스쇼핑 주가는 전날보다 7.52%(1천 원) 뛴 1만4300원에, GS홈쇼핑 주가는 0.72%(1천 원) 오른 13만9600원에, 현대홈쇼핑 주가는 0.89%(700원) 높아진 7만9400원에 거래를 마감했다. BGF리테일 주가는 1.87%(1만3500원)...",0
2366,2021-01-07,"새 비전 내놓은 현대百, 정지선·교선 형제경영 '한 번 더'","정 부회장은 현대홈쇼핑, 현대그린푸드 등 주요 계열사 사내이사직을 맡아왔지만, 유통 사업 내 핵심 계열사인 현대백화점은 정지선 회장의 영역이라는 외부 인식이 강했다. 현대그린푸드 등 비유통 사업은 정교선...",3
2367,2021-01-08,"'송출 수수료'에 발목 잡힌 TV홈쇼핑, 올해는 벗어날까",사진=현대홈쇼핑 방송장면 신종 코로나바이러스 감염증(코로나19) 사태 속에서 '집콕족'에 의해 수혜를 받은 홈쇼핑업계가?속앓이를 하고 있다. 8일 업계에 따르면 지난 2019년 홈쇼핑업계가 방송사업자에 지급한...,0
2368,2021-01-08,"아이디플라코스메틱, ‘플러스패치ㆍ마이너스밴드’ 시즌2 홈쇼핑 라이브 방송","75분간 현대홈쇼핑 라이브에서 단독 판매에 들어간다. 플러스패치2는 꺼지고 주름진 부위에 볼륨과 탄력을 부여하는 화장품이며, 마이너스밴드2는 턱과 이중턱, 목 등 하악 부위 리프팅 효과가 있는 제품이다. 현대홈쇼핑...",0
2369,2021-01-08,"아이디플라코스메틱, TV 라이브 '진출'… 현대홈쇼핑서 플러스패치·마이너스...","8일 아이디플라코스메틱에 따르면 '아이디 페이스핏 플러스 패치 브이2'(플러스패치2), '아이디 페이스핏 마이너스 밴드 브이2'(마이너스밴드2) 등 2종 제품이 9일 13시 45분부터 75분간 현대홈쇼핑 라이브에서 단독 판매에...",0
