,date,title,contents,label
1156,2020-07-01,탄탄한 성장으로 투자자 유혹하는 한섬,한섬은 브랜딩에 집중하고 현대백화점과 현대홈쇼핑 등 그룹사는 판매 채널 확장에 기여할 것으로 보인다. 성분에 대한 경각심 증대로 체크슈머가 늘면서 더마 화장품 시장의 성장세가 두드러지고 있다. 한섬이 최초...,0
1157,2020-07-01,오늘보다 내일이 더 기대되는 ‘고성장 CEO 20’,현대홈쇼핑은 2009년부터 ‘현대가 3세’인 정교선 현대백화점그룹 부회장이 대표를 맡아 이끌고 있다. 그는 ‘T커머스’를 중심으로 홈쇼핑 사업의 경쟁력을 높여 왔다. 지난해 현대홈쇼핑이 홈쇼핑 부문에서...,0
1158,2020-07-01,"유통주 혼조, 호텔신라 3%대 신세계 2%대 하락 현대백화점 상승","GS홈쇼핑 주가는 0.82%(900원) 높은 11만100원에, 현대홈쇼핑 주가는 0.63%(400원) 상승한 6만4400원에 거래를 끝냈다. GS리테일 주가는 0.82%(300원) 오른 3만6750원에 장을 마쳤다. 반면 BGF리테일 주가는 0.36%(500원)...",0
1159,2020-07-02,"토큰 휴대용 목걸이 선풍기, 현대홈쇼핑서 판매","소형가전 전문업체 토큰은 레트로 감성의 휴대용 목걸이 선풍기를 3일 현대홈쇼핑을 통해 선보인다고 2일 밝혔다. 휴대용 목걸이 선풍기가 홈쇼핑 채널에서 유통되는 것은 매우 이례적이며, 하 수직 쿨러형 송풍구조로...",0
1160,2020-07-02,"현대홈쇼핑, 차세대 유산균 ‘GC녹십자 마이크로바이옴 포스트바이오틱스’ 방...","GC녹십자가 2일 오후 1시 40분, 현대홈쇼핑에서 장 건강기능식품 ‘GC녹십자 마이크로바이옴 포스트바이오틱스’ 방송을 진행한다고 밝혔다. ‘GC녹십자 마이크로바이옴 포스트바이오틱스’는 차세대 유산균, 신개념...",0
1161,2020-07-02,"토큰(TOKN), 레트로 감성 휴대용 목걸이 선풍기 인기몰이…3일 현대홈쇼핑 출...","소형가전 전문업체 토큰은 레트로 감성의 휴대용 목걸이 선풍기를 3일 현대홈쇼핑을 통해 선보인다고 2일 밝혔다. 휴대용 목걸이 선풍기가 홈쇼핑 채널에서 유통되는 것은 매우 이례적이며, 하 수직 쿨러형 송풍구조로...",0
1162,2020-07-02,"유통주 강세, 현대백화점 호텔신라 3%대 GS홈쇼핑 2%대 올라","GS홈쇼핑 주가는 2%(2200원) 오른 11만2300원에, 현대홈쇼핑 주가는 0.16%(100원) 높아진 6만4500원에 각각 거래를 끝냈다. GS리테일 주가는 0.41%(150원) 상승한 3만6900원에 장을 마감했다. 반면 BGF리테일 주가는 0....",0
1163,2020-07-02,토큰 휴대용 목걸이 선풍기 현대홈쇼핑 출격,"소형가전 전문업체 토큰은 레트로 감성의 휴대용 목걸이 선풍기를 3일 현대홈쇼핑을 통해 선보인다고 2일 밝혔다. 휴대용 목걸이 선풍기가 홈쇼핑 채널에서 유통되는 것은 매우 이례적이며, 하 수직 쿨러형 송풍구조로...",0
1164,2020-07-02,"토큰(TOKN), 휴대용 목걸이 선풍기 3일 현대홈쇼핑 판매",소형가전 전문업체 '토큰(TOKN)'은 레트로 감성의 휴대용 목걸이 선풍기(사진)를 3일 현대홈쇼핑을 통해 선보인다고 2일 밝혔다. 휴대용 목걸이 선풍기가 홈쇼핑 채널에서 유통되는 것은 이례적이다. 하 수직 쿨러형...,0
1165,2020-07-02,"[넥스트K] 프랑스 휩쓴 'K세럼'…""3년 연구로 잔주름 싹""","그는 ""처음엔 1만~1만2000개 세트를 준비했는데, 인기를 끌면서 바로 재주문이 들어왔다""며 ""3년간 신세계TV쇼핑에서만 판매한 뒤 공용홈쇼핑 현대 롯데에 진출했고, 이달엔 CJ오쇼핑에도 판매하게 됐다""고 말했다. 홍콩...",0
1166,2020-07-03,[종목이슈] 다가오는 장마전선...장마철 수혜주에 단비 내릴까,"홈쇼핑 업체 CJ오쇼핑과 현대홈쇼핑 역시 이날 종가가 한달 전 주가가 더 낮은 모습을 보이면서, 장마철 수혜주라는 칭호가 무색해졌다. 이같은 현상은 제습기 등 생활가전 업체인 위닉스, 신일전자, 파세코...",0
1167,2020-07-03,"현대홈쇼핑, 파세코 창문형 에어컨 특별 방송 진행","파세코 창문형 에어컨 시즌2 판매수량 25,000개 돌파 … 오는 5일 하루간 3회 특별 편성 현대홈쇼핑이 여름 냉방 가전의 신흥 강자로 떠오른 '창문형 에어컨' 특별전을 진행한다. 현대홈쇼핑은 오는 5일 '파세코 창문형...",0
1168,2020-07-03,"현대홈쇼핑, 파세코 창문형 에어컨 특별 방송 진행","▲ CNB뉴스, CNBNEWS, 씨앤비뉴스 현대홈쇼핑에서 지난달 16일 진행한 파세코 창문형 에어컨 방송 화면. (사진=현대홈쇼핑) 현대홈쇼핑이 오는 5일 ‘파세코 창문형 에어컨’ 방송을 3회 특집 편성해 진행한다고 3일...",0
1169,2020-07-03,"[시경Today-유통]GS샵, 라마다 프라자 호텔·어트랙션 4종 판매 外","현대홈쇼핑, 파세코 창문형 에어컨 특별 방송 사진= 현대홈쇼핑 현대홈쇼핑은 오는 5일 '파세코 창문형 에어컨' 방송을 3회 특집 편성해 진행한다고 3일 밝혔다. 이 날 방송은 오전 10시, 오후 4시 10분, 오후 7시 25분에...",0
1170,2020-07-03,"현대홈쇼핑, 파세코 '창문형 에어컨' 3회 특집편성","현대홈쇼핑이?오는 5일 '파세코 창문형 에어컨' 방송을 3회 특집 편성해 진행한다고 3일 밝혔다. 이날 방송은 오전 10시, 오후 4시 10분, 오후 7시 25분에 진행한다고 3일 밝혔다. 이번에 선보이는 상품은 '파세코 창문형...",0
1171,2020-07-03,노폐물 흡착과 보습효과를 동시에 ‘트랑쎄 머드스틱’ 현대홈쇼핑 2차 앵콜 ...,프리미엄 홈스파 케어 브랜드 ‘트랑쎄’가 다가오는 10일 금요일 오후 1시 40분 현대홈쇼핑을 통해 2차 방송을 진행한다. 지난달 20일 트랑쎄는 현대홈쇼핑을 통해 신제품 ‘더블 액션 머드스틱’을 처음으로 선보였다....,0
1172,2020-07-03,"유통주 대체로 상승, 현대백화점 BGF리테일 3%대 신세계 2%대 올라",27%(100원) 높아진 3만7천 원에 각각 거래를 끝냈다. GS홈쇼핑 주가는 0.18%(200원) 오른 11만2500원에 장을 마쳤다. 현대홈쇼핑 주가는 0.16%(100원) 상승한 6만4600원에 거래를 마감했다. [비즈니스포스트 ],0
1173,2020-07-03,"현대홈쇼핑, 7월 5일 파세코 창문형 에어컨 특별 방송 진행","파세코 창문형 에어컨 시즌2 판매수량 25,000개 돌파 … 오는 5일 하루간 3회 특별 편성해 방송 현대홈쇼핑이 여름 냉방 가전의 신흥 강자로 떠오른 '창문형 에어컨' 특별전을 진행한다. 현대홈쇼핑은 오는 5일 '파세코...",0
1174,2020-07-03,"현대홈쇼핑, 파세코 창문형 에어컨 특별 방송 진행","현대홈쇼핑이 여름 냉방 가전의 신흥 강자로 떠오른 '창문형 에어컨' 특별전을 진행한다. 현대홈쇼핑은 5일 '파세코 창문형 에어컨' 방송을 3회 특집 편성해 진행한다고 3일 밝혔다. 이날 방송은 오전 10시, 오후 4시10분...",0
1175,2020-07-03,"김성령 브론 대표, 인앤아웃과 현대홈쇼핑의 콜라보 7월 8일 출연",‘브론’ 뷰티라이프와 의류 온라인쇼핑몰 그리고 인플루언서로 활동하고 있는 김성령 대표가 현대홈쇼핑 라이브커머스인 ’쇼핑라이브‘에 7월 8일 오후 6시 부터 1시간 라이브 방송을 하며 ‘인앤아웃팩’을 특가...,0
1176,2020-07-06,‘셀프메디케이션 열풍’ 한 끼 식사와 영양 보충을 한 번에,"지난 6월 22일, 현대홈쇼핑을 통해 처음 선보인 더뉴트리밀은 ‘건강한 한 끼’와 ‘건강한 습관’을 표방하며 할리우드에서 활동하는 배우 다니엘헤니가 상품 기획과 모델로 참여 해, 출시 이후로 고객들의 많은 관심을...",0
1177,2020-07-06,의정부 헬스장 19명 감염 vs 부천 헬스장 0명…어떻게 했길래,"금천구 현대홈쇼핑 콜센터에서는 69명 중 5명(7.2%)만 감염되는 데 그쳤다. 이 콜센터는 근무자 책상 사이 추가 가림막을 설치하고, 좌석을 지그재그로 배치하는 등 근무 환경을 방역에 맞게 적용하고 있었다. 또 식사...",6
1178,2020-07-06,"03일 코스피 시장 공매도 비중 상위 종목.?서울가스, CJ CGV 등",84%0.00%[페인트]19현대홈쇼핑(057050)0.83%+0.16%인터넷과 카탈로그 소매20오리온홀딩스(001800)0.83%+0.75%[음식료 - 제과]※ 주가 등락률: 전일 장마감 기준 등락률 [C-Biz봇],0
1179,2020-07-06,"현대홈쇼핑, 온라인 전용 홈케어 브랜드 '에버블루' 선봬","인더뉴스 남궁경 기자ㅣ현대홈쇼핑이 밀레니얼 세대 공략을 위해 온라인 전용 브랜드를 선보입니다. 빠르게 변화하는 트렌드를 반영해 상품을 개발하고, 전용 온라인몰과 SNS를 통해 20~30대 젊은 고객들의 눈길을...",0
1180,2020-07-06,"플래티어, KB증권 IPO 주관사 선정...""내년 하반기 상장”","플래티어, IPO주관사로 KB증권 선정 플래티어의 이커머스플랫폼 솔루션은 롯데이커머스, 롯데홈쇼핑, 현대백화점, 현대자동차, CJ올리브영, 신세계, 한국타이어 등 주요고객사가 채택했다. 기업들의 디지털혁신에...",0
1181,2020-07-06,"유통주 혼조, 현대백화점 3%대 오르고 호텔신라 GS리테일 내려","현대홈쇼핑 주가는 0.15%(100원) 높은 6만4700원에, GS홈쇼핑 주가는 0.09%(100원) 상승한 11만2600원에 각각 장을 마감했다. 편의점업체 주가를 살펴보면 BGF리테일 주가는 14만2500원에 거래를 끝내 직전 거래일과...",0
1182,2020-07-06,"현대홈쇼핑, 온라인 전용 홈케어 브랜드 ‘에버블루’ 런칭",자연 유래 성분 강화한 ‘다목적 클리너’ 제품 첫선 … 매월 신제품 출시 20~30대 젊은 고객 위한 제품 기획해 전용 온라인몰에서만 판매 현대홈쇼핑이 밀레니얼 세대 공략을 위해 온라인 전용 브랜드를 선보인다....,0
1183,2020-07-07,"플래티어, IPO 주관사로 KB증권 선정… 코스닥 상장 본격 시동","KB증권은 프리 IPO로 직접 지분 투자까지 집행할 정도로 플래티어의 전망을 긍정적으로 평가하고 있다.플래티어의 이커머스 플랫폼 솔루션은 롯데이커머스, 롯데홈쇼핑, 현대백화점, 현대자동차, CJ올리브영, 신세계...",0
1184,2020-07-07,"플래티어, 2021년 코스닥 상장 추진...AI 마케팅 투자 확대","플래티어 이커머스 플랫폼 솔루션은 롯데이커머스, 롯데홈쇼핑, 현대백화점, 현대자동차, CJ올리브영, 신세계, 한국타이어 등 다양한 국내 유통·제조 기업을 주요 고객사로 확보하고 있다. 규모가 크고 사업 구조가...",0
1185,2020-07-07,거짓말·노마스크·격리 위반…‘코로나 확산’ 차단 방역수칙 준수에 달렸다,"현대홈쇼핑 콜센터에서도 근무자 책상 사이 추가 가림막 설치, 지그재그 좌석 배치, 혼밥 권장 등으로 집단감염을 막았다. 역시 마스크 착용이 소홀했던 대구 연기학원에서는 10명의 환자가 무더기로 발생했다. 지난 3일...",6
1186,2020-07-07,"하룻밤 300만원…특급호텔 ""VVIP 모셔라""","현대홈쇼핑은 11일 오후 10시 25분 디럭스룸, 조식, 수영장·피트니스 이용권 등이 포함된 '임피리얼 팰리스 호캉스 패키지'를 판매한다. 판매 가격은 14만9000원이다. 롯데홈쇼핑도 10일 오후 7시 40분 '페어필드 바이...",0
1187,2020-07-07,"유통주 대체로 떨어져, 현대백화점 이마트 하락 호텔신라 상승","GS홈쇼핑 주가는 1.15%(1300원) 내린 11만1300원에, 현대홈쇼핑 주가는 0.77%(500원) 떨어진 6만4200원에 각각 거래를 끝냈다. BGF리테일 주가는 1.05%(1500원) 빠진 14만1천 원에 장을 마쳤다. 반면 GS리테일 주가는 3....",0
1188,2020-07-07,"[마켓인사이트]플래티어, IPO 주관사로 KB증권 선정...코스닥 상장 시동","플래티어의 이커머스 플랫폼은 롯데이커머스, 롯데홈쇼핑, 현대백화점, 현대자동차, CJ올리브영, 신세계, 한국타이어 등 다양한 국내 대형 유통제조기업에 사용되고 있다. 규모가 크고 사업 구조가 복잡한 대기업의...",0
1189,2020-07-07,"현대홈쇼핑, 여름철 건강관리 위한 ‘GC녹십자 마이크로바이옴 포스트바이오틱...",GC녹십자가 오는 8일 현대홈쇼핑을 통해 장 건강기능식품 ‘GC녹십자 마이크로바이옴 포스트바이오틱스’ 판매 방송을 진행한다고 7일 밝혔다. 해당 방송은 오전 7시 15분부터 8시 15분까지 60분간 진행된다. 여름철에는...,0
1190,2020-07-07,"플래티어, IPO 본격 시동…주관사로 KB증권 선정","플래티어의 이커머스 플랫폼 솔루션은 롯데이커머스와 롯데홈쇼핑, 현대백화점, 현대자동차, CJ올리브영, 신세계, 한국타이어 등 다양한 국내 대형 유통·제조 기업을 주요 고객사로 확보하고 있다. 특히 규모가 크고...",0
1191,2020-07-07,"플래티어, IPO주관사 KB증권 선정…내년 하반기 코스닥 상장 추진","플래티어의 이커머스플랫폼 솔루션은 롯데이커머스, 롯데홈쇼핑, 현대백화점, 현대자동차, CJ올리브영, 신세계, 한국타이어 등 다양한 국내 대형 유통·제조기업을 주요고객사로 확보하고 있다. 디지털 혁신에 필수적인...",0
1192,2020-07-07,"플래티어, IPO 주관사로 KB증권 선정…코스닥 상장 준비 본격 시동","플래티어의 이커머스 플랫폼 솔루션은 롯데이커머스, 롯데홈쇼핑, 현대백화점, 현대자동차, CJ올리브영, 신세계, 한국타이어 등 다양한 국내 대형 유통·제조 기업을 주요 고객사로 확보하고 있다. 특히 규모가 크고...",0
1193,2020-07-08,제주도민 배송비 부담 커…육지권 4.9배,TV홈쇼핑(GS홈쇼핑·현대홈쇼핑·롯데홈쇼핑·홈앤쇼핑·공영쇼핑)에서 구매하는 441개 제품 중에는 52개 제품(11.8%)에 특수배송비가 청구되고 있다. 하지만 특수배송비 인하에도 제주지역 평균배송비(특수배송비 포함)...,0
1194,2020-07-08,"앱코, 현대홈쇼핑 통해 AGC21 게이밍 의자 판매","삶의 새로운 패러다임, '뉴 라이프 플랫폼'을 만들어가는 주식회사 앱코(대표이사: 오광근)가 현대홈쇼핑 채널을 통해 ABKO HACKER AGC21 게이밍 의자(이하 AGC21) 판매를 진행한다고 밝혔다. 오는 9일 오전 1시 20분부터...",0
1195,2020-07-08,"유통주 대체로 하락, 호텔신라 현대백화점 신세계 모두 내려","GS홈쇼핑 주가는 2.25%(2500원) 내린 10만8800원에, 현대홈쇼핑 주가는 0.78%(500원) 낮아진 6만3700원에 각각 거래를 마감했다. BGF리테일 주가는 2.48%(3500원) 떨어진 13만7500원에 장을 마쳤다. 반면 GS리테일 주가는...",0
1196,2020-07-08,"제주지역 택배 배송비, 육지권보다 4.9배 더 낸다","조사품목은 전자기기(87개), 식품·의약품(120개), 생활용품(120개), 화장품(120개), 가구·침구류(108개), 의류·섬유용품(120개), 취미용품(120개), 가전제품(120개)이며, 조사업체는 TV홈쇼핑 6개(GS홈쇼핑·현대홈쇼핑...",0
1197,2020-07-08,"제주지역 평균 특수배송비 2,300원… 전년 比1,603원 감소","(GS홈쇼핑, 현대홈쇼핑, 롯데홈쇼핑, NS홈쇼핑, 홈앤쇼핑, 공영쇼핑) / 오픈마켓(쿠팡, 옥션, 11번가, G마켓) / 소셜커머스(티켓몬스터, 위메프)이다. 조사결과 대상 915개 제품 가운데 54.6%(499건)가 제주지역 특수 배송비를...",0
1198,2020-07-08,불황에 몸살 난 호텔업계…홈쇼핑 판매로 탈출구 찾기,부산 해운대에 있는 코오롱 씨클라우드호텔은 지난달 24일 현대홈쇼핑에서 객실 패키지 상품을 정상 가격보다 70%까지 할인된 가격에 판매했다. 임피리얼 팰리스도 오는 11일에 현대홈쇼핑에서 패키지를 14만9천 원에...,0
1199,2020-07-08,"[더벨][TV홈쇼핑 점검]공영홈쇼핑, 경고 3건에도 신속 대응 배경은","GS홈쇼핑(1점), 홈앤쇼핑(1점), 현대홈쇼핑(1점), NS홈쇼핑(3점)보다 많다. 이를 포함해 재승인을 받은 2018년 4월부터 올해 5월까지 공영홈쇼핑이 받은 방심위 법정제재을 모두 합산할 시 총 7건에 이른다. 방심위의 제재가...",2
1200,2020-07-08,"""어머, 이건 사야해"" 한마디에 10년간 1조6700억원어치 팔려",◇현대홈쇼핑 '왕영은의 톡 투게더' 현대홈쇼핑은 2018년 12월 특급 진행자 왕영은씨를 영입했다. 이후 1년간 누적 주문액이 약 1500억을 기록하는 등 '신기록 제조기'라는 별명을 갖게 됐다. 현대홈쇼핑 측은 '왕톡' 방송...,0
1201,2020-07-08,"콜라겐마스크팩 더마픽스, 콜라겐 링클패치 선보여","CJ오쇼핑, 현대홈쇼핑 등, 다양한 홈쇼핑에서 누적판매 기록 430억 이상을 달성한 더마픽스가 눈가팔자주름을 집중 관리할 수 있는 '리얼콜라겐 텐션업 링클패치'를 선보인다. 피부 흡수에 용이한 이태리 직수입 500달톤...",0
1202,2020-07-09,"TV홈쇼핑, 경쟁력 있는 PB 육성... ""차별화로 채널 충성도 강화""",현대홈쇼핑은 2017년 프리미엄 PB 라씨엔토와 이듬해 밀라노스토리를 각각 론칭하며 패션 사업에 사활을 걸고 있다. 회사는 이들 두 PB 브랜드를 3년내 1000억원 규모의 '메가 브랜드'로 규모를 키운다는 계획이다. 이...,0
1203,2020-07-09,"유통주 대체로 하락, 신세계 현대백화점 내리고 이마트 2%대 올라",45%(2천 원) 하락한 13만5500원에 거래를 끝냈다. 현대홈쇼핑 주가는 1.41%(900원) 떨어진 6만2800원에 거래를 마쳤다. 반면 GS홈쇼핑 주가는 0.74%(800원) 오른 10만9600원에 장을 마감했다. [비즈니스포스트 ],0
1204,2020-07-09,무더위 시작되자… 냉방가전 불티나게 팔린다,"현대홈쇼핑에서 파세코 에어컨은 지난해 첫 론칭 이후 판매량 1만8000여대, 누적 주문액 75억원을 기록했다. 올해 제품 성능을 개선한 시즌2 제품을 지난 4월 론칭했는데 현재까지 2만5000여대(주문금액 175억원)가 팔릴...",0
1205,2020-07-09,"뉴트리원 비비랩, 파우더 타입의 콜라겐 제품 '누적 판매량 2천만포 돌파'","파우더 타입의 콜라겐인 ‘더 콜라겐 파우더S’ 제품은 현대홈쇼핑, 홈앤쇼핑, 롯데홈쇼핑 등 다양한 홈쇼핑 채널에서 합 21회의 매진을 기록하며 판매 중이다. 뉴트리원 관계자는 “점차 셀프 케어 중심의 건강 관리가...",0
1206,2020-07-10,"유통주 대체로 떨어져, BGF리테일 4%대 현대백화점 3%대 밀려","68%(250원) 낮아진 3만6600원에 거래를 마쳤다. 현대홈쇼핑 주가는 1.75%(1100원) 하락한 6만1700원에, GS홈쇼핑 주가는 1.73%(1900원) 내린 10만7700원에 장을 마감했다. [비즈니스포스트 ]",0
1207,2020-07-10,"에버콜라겐, 현대홈쇼핑 ‘왕영은의 톡투게더’ 특집 방송 출격",오는 7월 11일(토) 아침 8시 20분부터 9시 20분까지 현대홈쇼핑 ‘왕영은의 톡투게더’에서 건강기능식품 전문 기업 ㈜뉴트리의 먹는콜라겐 브랜드 에버콜라겐의 대표 상품인 ‘인앤업 플러스’를 소개한다. 이번 방송은...,0
1208,2020-07-10,[더벨][T커머스 점검]2021년 재승인 심사 도래…사업 안착 도움될까,△GS마이샵(GS홈쇼핑) △CJ오쇼핑+(CJ오쇼핑) △현대홈쇼핑+샵(현대홈쇼핑) △롯데원OneTV(롯데홈쇼핑) △NS샵+(NS홈쇼핑) 등 5개 채널은 TV홈쇼핑 업체들이 겸업하고 있다. T커머스는 2005년 사업권을 받았지만 정작 사업이...,0
1209,2020-07-10,"에버콜라겐, 현대홈쇼핑 '왕영은의 톡투게더' 11일 방송",오는 7월 11일(토) 아침 8시 20분부터 9시 20분까지 현대홈쇼핑 '왕영은의 톡투게더'에서 건강기능식품 전문 기업 ㈜뉴트리의 먹는콜라겐 브랜드 에버콜라겐의 대표 상품인 '인앤업 플러스'를 소개한다. 이번 방송은...,0
1210,2020-07-13,"유통주 대체로 강세, 이마트 4%대 현대백화점 신세계 1%대 올라","현대홈쇼핑 주가는 2.27%(1400원) 오른 6만3100원에, GS홈쇼핑 주가는 1.11%(1200원) 높아진 10만8900원에 각각 장을 마쳤다. GS리테일 주가는 0.82%(300원) 상승한 3만6900원에 거래를 마감했다. 반면 BGF리테일...",0
1211,2020-07-13,SK바이오팜 ‘따상’에 달아오른 IPO 시장…빅히트·카카오게임즈·젝시믹스(...,"롯데홈쇼핑, 현대백화점, 삼성전자 등을 고객사로 보유했다. 이외 분야에서는 명신산업, 브랜드엑스코퍼레이션 등이 주목받는다. 명신산업은 엠에스오토텍 자회사로 자동차 부품을 만든다. 현대차, 기아차, 테슬라...",0
1212,2020-07-13,사과 빠진 ABC주스 판매…원재료 속인 홈쇼핑 ‘논란’,"업계에 따르면 방송통신위원회는 해당 ABC주스를 판매한 GS홈쇼핑, 현대홈쇼핑, 롯데홈쇼핑 등 6개 업체에 대해 심의 절차에 착수했다. 방통위는 오는 14일 이들 업체의 의견진술을 듣고 경중을 따져 행정 조치를 취할...",2
1213,2020-07-13,"현대百그룹, ""10년이면 강산도 변하는데""…'형제경영' 한 길만","이어지는 마지막 순환출자 고리도 자연스럽게 해결됐다. 정 회장은 은행 차입으로 지분 매입에 필요한 자금을 마련했고, 정 부회장은 본인 소유의 현대홈쇼핑 주식 전량을 매각했다. [CEO스코어데일리 / / ]",3
1214,2020-07-13,"""히라앰플, 업그레이드됐다""…하희라, 20일 현대홈쇼핑 출격",하희라는 오는 20일 오전 9시 25분 '현대홈쇼핑' 생방송에 출연한다. 60분간 '하희라 앰플 화이트닝' 론칭 방송을 진행할 예정이다. '하희라 앰플 화이트닝'은 하희라와 '제이원 코스메틱'이 손잡고 준비한 제품이다. 기존...,0
1215,2020-07-13,아이스팩 제조·수입업자 폐기물부담금 부과 본격 검토,"환경부는 아이스팩 재사용을 확대를 위해 지난해 12월 현대홈쇼핑, 서울특별시상인연합회, 소바자시민모임과 ‘아이스팩 재사용 활성화를 위한 자발적 협약’ 체결했다. 환경부의 협약에 힘입어 아이스팩 재사용이...",1
1216,2020-07-13,"[단독] GS홈쇼핑, 빅3 홈쇼핑 중 올해 2분기 예상 매출액 증가율 1위, 왜?","[자료=더밸류뉴스] 이어 현대홈쇼핑은 0.9% 증가하고, CJ ENM은 30.35% 감소할 것으로 전망된다. GS홈쇼핑 분기별 매출액 추이. [이미지=더밸류뉴스] 1위를 기록한 GS홈쇼핑은 홈쇼핑프로그램 공급사업, 홈쇼핑프로그램의...",0
1217,2020-07-13,[홈쇼핑 2.0] 허태수 '모바일 혁신' 기초체력 다졌다,"현대홈쇼핑 인터넷부문의 매출은 2853억원, 영업이익은 328억원을 기록했다. GS홈쇼핑 모바일부문 성과에 비해 크게 뒤쳐지는 수준이다. 허 회장의 모바일 사업 중심 전략은 TV홈쇼핑산업의 성장 둔화와 맞물려...",0
1218,2020-07-14,"원재료 허위 표시로 시청자 기만한 6개 상품판매방송, 중징계 검토","롯데홈쇼핑, 현대홈쇼핑, SK스토아, 신세계쇼핑, K쇼핑)에 대해 전체회의에서 '중징계 여부 및 제재 수위'를 재차 논의하기로 했다. 광고심의소위원회는 ""원재료에 대한 확인 및 검증 절차 미비로 인해 '스타애플'이...",2
1219,2020-07-14,"소버스, 몽모랑시 타트체리 원액 농축 '몽모랑시 타트체리 38.8' 출시","신제품 '몽모랑시 타트체리 38.8'은 소버스 온라인 공식 사이트 및 백화점에서 구매할 수 있으며, 오는 20일 오전 8시 15분부터 방송되는 현대홈쇼핑을 시작으로 유통망을 더욱 확대할 계획이다. 소버스는 현대홈쇼핑...",0
1220,2020-07-14,"대놓고 PPL한 김은숙 드라마 '더 킹', 방심위 경고 받는다","한편, 이날 광고심의소위원회는 “‘스타애플’로 제조한 주스상품을 ‘사과’가 원재료인 것처럼 시청자를 기만하고 소비자 피해를 유발한” 6개 상품판매방송사(GS SHOP, 롯데홈쇼핑, 현대홈쇼핑, SK스토아, 신세계쇼핑...",2
1221,2020-07-14,윤곽 잡히는 현대HCN 매각…현대백화점그룹의 다음 행보는?,"현대백화점은 지난 2015년, 계열사 현대홈쇼핑이 별도로 설립한 '현대렌탈케어'를 통해 생활가전 렌탈 사업에 진출했으나, 아직 업계 중하위권에 머물러 있다. 렌탈 사업에 대한 그룹의 투자는 적지 않았다. 자본금...",0
1222,2020-07-14,"유통주 혼조, 호텔신라 신세계 내리고 현대백화점 현대홈쇼핑 올라","반면 현대홈쇼핑 주가는 2.22%(1400원) 상승한 6만4500원에 거래를 끝냈다. BGF리테일 주가는 1.56%(2천 원) 내린 12만6500원에, GS리테일 주가는 0.54%(200원) 높아진 3만7100원에 각각 장을 마감했다....",0
