,date,title,contents
2621,2021-01-04,"오프라인 유통사, '위드 코로나' 시대엔 과거 영광 재현할까?",지난해 GS홈쇼핑과의 합병을 발표한 GS리테일은 통합 작업의 일환으로 최근 GS샵과 택배 물류 효율화를 진행했다. GS샵에서 주문한 상품을 GS25의 비대면 택배보관함 BOX25를 통해 수령할 수 있도록 한 것이다. 또 GS25는...
2622,2021-01-05,편의점에서 '프리미엄 베이커리 전쟁' 발발,5일 편의점 업계에 따르면 GS리테일은 GS25 등 자사 내 유통 계열사를 통해 빵 브랜드 '브레디크'를 론칭했고 구랍 24일 BGF리테일은 CU를 통해 베이커리 라인을 론칭해 첫상품을 선보였다. 또 세븐일레븐은 숙명여대...
2623,2021-01-05,"경북대 이병헌 석사과정생, 2020 빅콘테스트 대상 수상","혁신아이디어 분야와 데이터분석 분야의 2개 리그(퓨처스 리그, 챔피언 리그)로 열린 이번 대회는 한국정보통신진흥협회, SK텔레콤, 신한카드, 와이즈넛, GS리테일, CJ올리브네트웍스, 스포츠투아이, NS홈쇼핑이 참여해..."
2624,2021-01-05,"경북대 이병헌 석사과정생, 2020 빅콘테스트 대상 수상","혁신아이디어 분야와 데이터분석 분야의 2개 리그(퓨처스 리그, 챔피언 리그)로 열린 이번 대회는 한국정보통신진흥협회, SK텔레콤, 신한카드, 와이즈넛, GS리테일, CJ올리브네트웍스, 스포츠투아이, NS홈쇼핑이 참여해..."
2625,2021-01-05,베이커리 못지않네…`프리미엄 빵` 공략 나서는 편의점,"GS리테일은 5일 프리미엄 빵 브랜드 '브레디크'(사진)를 론칭하고 GS25와 GS더프레시에서 판매한다고 밝혔다. 브레디크를 통해 베이커리 전문점 이상의 고품질 베이커리를 판매, 늘어나는 식사빵 수요를 끌어들이겠다는..."
2626,2021-01-05,"편의점, 베이커리에 도전…'프리미엄 빵' 전쟁",GS리테일은 편의점 GS25와 슈퍼마켓 GS더프레쉬에서 새로운 빵 브랜드 ‘브레디크’(BREADIQUE)를 선보인다고 5일 밝혔다. 세븐일레븐도 이날 프리미엄 베이커리 ‘밤단팥빵’과 ‘연유크림소보로빵’ 등 2종을...
2627,2021-01-05,편의점서 사 먹는 '식사대용 빵'…베이커리 고급화 바람,"GS리테일은 편의점 GS25와 슈퍼마켓 GS더프레시에서 새로운 빵 브랜드 '브레디크'(BREADIQUE)를 선보였다. '브레드'(Bread)와 '부티크'(Boutique), '유니크'(Unique)를 조합해 만들었다. 고급 베이커리 전문 브랜드를 표방한다...."
2628,2021-01-05,[금일 유통업계 주요기사]'영업제한'에 오픈시위 이어 헌법소원 '저항확산'.....,"◆편의점, 베이커리 고급화 '바람' GS리테일은 편의점 GS25와 슈퍼마켓 GS더프레시에서 새로운 빵 브랜드 '브레디크'(BREADIQUE)를 선보인다고. 편의점 업계가 최근 잇따라 고급 빵을 내놓으며 전문 베이커리 영역을..."
2629,2021-01-05,"경북대 이병헌 석사과정생, ‘2020 빅콘테스트’ 대상 수상","혁신아이디어 분야와 데이터분석 분야의 2개 리그(퓨처스 리그, 챔피언 리그)로 열린 이번 대회는 한국정보통신진흥협회, SK텔레콤, 신한카드, 와이즈넛, GS리테일, CJ올리브네트웍스, 스포츠투아이, NS홈쇼핑이 참여해..."
2630,2021-01-05,"GS리테일, 프리미엄 빵 브랜드 ’브레디크’ 출시","편의점 GS25, 슈퍼마켓 GS THE FRESH가 빵 맛집 ‘브레디크’로 변신한다.GS리테일이 운영하는 편의점 GS25와 슈퍼마켓 GS THE FRESH(GS더프레시)는 새로운 빵 브랜드 ‘BREADIQUE(브레디크)’를 선보인다고 5일 밝혔다...."
2631,2021-01-05,"브랜드 뷰가닉, 유기농 전문 온라인몰 '달리살다' 입점",자연주의 클렌징 브랜드 뷰가닉(Beauganic)이 GS 리테일이 새롭게 런칭한 종합 온라인몰 '달리살다'에 입점했다고 5일 밝혔다. GS 리테일이 신사업으로 만든 유기농 전문 온라인몰 '달리살다'는 '오늘부터 달리 살다'라는...
2632,2021-01-06,"편의점, 전문점 수준 베이커리 맛 구현","6일 관련 업계에 따르면 GS리테일은 편의점 GS25와 슈퍼마켓 GS더프레시에서 '브레디크'(BREADIQUE)를 선보인다. 빵을 뜻하는 '브레드'(Bread)와 질 좋은 제품을 취급하는 점포를 뜻하는 '부티크'(Boutique), 새로움과 특별함을..."
2633,2021-01-06,편의점 ‘빵식’ 인기에… 프리미엄 빵 출시경쟁 불 붙었다,"GS25를 운영하는 GS리테일은 프리미엄 빵 브렌드 '브레디크'를 내놓으며 첫 상품으로 '브레디크 순우유식빵', '브레디크 순우유스틱빵', '브레디크 순우유모닝롤', '브레디크 레몬큐브파운드' 등 총 4종을 선보였다...."
2634,2021-01-06,"한신평 ""유통업 전망 어둡다""","송 실장은 ""SSM의 경우 근거리 소비 확산으로 지난해 수익성이 개선됐고 GS리테일과 롯데쇼핑 등이 저수익점포를 구조조정한 효과도 나오고 있어 흑자기조를 유지할 것으로 보인다""고 진단했다. 편의점에 대해서는..."
2635,2021-01-06,"[Invest]""올해도 등급하향 기조 계속…산업별 차별화 예상""","지난해부터 투자유치(쿠팡, SSG닷컴, 11번가, 위메프), GS리테일과 GS홈쇼핑 합병(GS리테일-GS홈쇼핑), 업체 간 제휴(11번가-아마존, 네이버-CJ대한통운 등)에 더불어 올해 쿠팡(나스닥), 티몬(국내)의 상장 추진 등 국내..."
2636,2021-01-06,"'미니언즈2 캐릭터 미리 만나자' GS25, 유니버설스튜디오와 전략적 제휴 확대",GS리테일이 운영하는 편의점 GS25가 세계적인 콘텐츠 제작사 유니버설스튜디오(이하 유니버설)와 손잡고 지난달 ▲미니언즈과일젤리 ▲트롤과일젤리 ▲쥬라기공룡화석초컬릿을 연이어 선보이며 제휴 캐릭터 상품...
2637,2021-01-06,‘5조 몸값’ 이베이코리아 매각 본격화,"그는 또 ""현대백화점, 신세계, GS리테일 등 유통관련 대기업들이 현재 주력 원매자로 거론되고 있지만 코로나19 등 여러 변수와 높은 몸 값으로 인해 흥행 여부는 끝까지 뚜껑을 열어봐야 할 것 같다""고 덧붙였다. 인수합병..."
2638,2021-01-06,“또 집콕이야?” 편의점서 진로이즈백 품귀현상,GS리테일 관계자는 “가정용 소주 발주에 제한이 생길 수 있어 미리 소주 물량을 확보해뒀다”며 “전국 GS25매장에서는 공급에 문제가 없다”고 설명했다. 하이트진로 관계자는 “2.5단계가 연장되면서 가정용 소주 생산...
2639,2021-01-06,또 불거진 이베이코리아 매각설…'몸값 5조' 거래 성사될까,"CJ그룹과 네이버의 지분 교환, GS리테일과 GS홈쇼핑의 합병 등 덩치 키우기가 계속되는 가운데 이베이코리아를 인수하면 단번에 국내 이커머스 1위로 도약할 수 있어 행보가 주목된다. 업계의 한 관계자는 ""5조 원에..."
2640,2021-01-06,'GS25에 가면 미니언즈2 캐릭터가'…상품 도입 확대,6일 GS리테일에 따르면 GS25는 세계적인 콘텐츠 제작사 유니버설스튜디오(이하 유니버설)와 손잡고 △미니언즈과일젤리 △트롤과일젤리 △쥬라기공룡화석초컬릿 등을 연이어 선보이며 제휴 캐릭터 상품 도입을...
2641,2021-01-06,"GS25-유니버설스튜디오, 전략적 제휴 확대 추진…IP 활용 상품 선보여","GS리테일이 운영하는 편의점 GS25는 세계적 콘텐츠 제작사 유니버설스튜디오(이하 유니버설)와 손잡고 지난달 미니언즈과일젤리, 트롤과일젤리, 쥬라기공룡화석초컬릿을 연이어 선보이며 제휴 캐릭터 상품 도입을..."
2642,2021-01-07,"이번 편의점 설 선물 'FLEX, 프리미엄'",GS리테일이 운영하는 GS25는 이번 설날 선물 중 눈에 띄는 것은 황금소코인(금주화)와 한우 한마리 상품이다. 황금소코인은 소 캐릭터와 복주머니가 함께 디자인 된 한정판으로 금 중량이 서로 다른 3종을 각 100개씩 총...
2643,2021-01-07,"한국로봇산업진흥원(KIRIA), 대형빌딩 및 호텔의 로봇 도입 사례 발표(上)",계획이다 GS리테일이 론칭한 AI 로봇 배달 서비스 (사진 GS리테일) &amp;bull 로봇 및 드론 활용한 GS리테일 GS리테일과 LG전자는 로봇이 상품을 배송하는 서비스의 실증 테스트를 진행했다 이들은 지난 2020년 8월에...
2644,2021-01-07,"범LG家 아워홈, GS 손잡고 아파트 커뮤니티 사업 확장한다","아워홈과 GS는 범 LG가로, 아워홈은 구인회 LG그룹 창업자의 3남인 구자학 회장이 GS리테일(당시 LG유통)의 식품 서비스사업부를 분리해 만든 회사다. 동업자인 고(故) 허만정 회장의 손자 허창수 GS 명예회장(당시 LG건설..."
2645,2021-01-07,"'설 선물은 소플렉스' GS25, 150만원 한우한마리·317만원 황금소코인 출시","뷰어스 심영범 기­자 GS리테일이 운영하는 편의점 GS25가 신축년 설 선물세트 판매에 돌입한다. 이번에 준비한 설 선물세트는 한우, 수산, 과일, 주류, 통조림, 가전제품, 위생용품, 생필품 등 50여 분류의..."
2646,2021-01-07,"유통주 대부분 올라, 이마트 8%대 엔에스쇼핑 7%대 뛰어","89%(700원) 높아진 7만9400원에 거래를 마감했다. BGF리테일 주가는 1.87%(1만3500원) 상승한 13만6500원에, GS리테일 주가는 0.99%(350원) 오른 3만5550원에 장을 끝냈다. [비즈니스포스트 ]"
2647,2021-01-07,"GS25, 신축년 설 선물세트 공급 시작, 키워드는 ‘소(牛)플렉스’","GS리테일이 운영하는 편의점 GS25가 신축년 설 선물세트 판매에 돌입한다. 이번에 준비한 설 선물세트는 한우, 수산, 과일, 주류, 통조림, 가전제품, 위생용품, 생필품 등 50여 분류의 700여종이다. 코로나19로 직접..."
2648,2021-01-07,"GS25, 신축년 설 선물세트 출시…""키워드는 '소 플렉스'""","GS리테일은 편의점 GS25가 신축년 설 선물세트 판매에 돌입한다고 7일 밝혔다. GS리테일에 따르면 이번에 준비한 설 선물세트는 한우, 수산, 과일, 주류, 통조림, 가전제품, 위생용품, 생필품 등 50여 분류의..."
2649,2021-01-07,"편의점, 올해 설 선물세트 키워드는 '프리미엄'","사진=GS리테일 제공. GS25는 700여종의 선물 세트를 판매하는 가운데 신축년을 맞아 '소(牛)플렉스' 콘셉트로 기획한 설 선물세트를 대거 선보였다. 먼저, 우월한우한마리세트는 최상급 한우 한마리를 그대로..."
2650,2021-01-07,"신축년 설 선물세트 키워드 '소 플렉스'‥GS25, 150만원 한우한마리?317만원 ...","포함 GS리테일이 운영하는 편의점 GS25가 신축년 설 선물세트 판매에 돌입한다. 이번에 준비한 설 선물세트는 한우, 수산, 과일, 주류, 통조림, 가전제품, 위생용품, 생필품 등 50여 분류의 700여종이다. 코로나19로..."
2651,2021-01-07,소고기 먹고 힘내세요…신축년 '소' 마케팅 펼치는 유통업계,GS25가 설 선물세트로 출시한 투뿔넘버나인 우월한우한마리세트 상품 이미지 / GS리테일 제공  유통업계가 신축년 소띠 해를 맞아 고급 식재료로 꼽히는 '소고기'를 활용한 마케팅에 돌입했다. 7일 편의점 GS25에 따르면...
2652,2021-01-08,"서산시, 지역 농산물 '비대면 판로확대' 추진","또한 대형 유통매장을 보유한 CJ프레시웨이, GS리테일, 롯데마트, E마트 등 대형유통업체 발굴에도 힘쓰기로 했다. 이외에도 비대면 판매 활성화를 위해 공영 또는 GS 등 국내 메이저급의 TV 홈쇼핑과 라이브커머스 등을..."
2653,2021-01-08,"유통주 강세, 이마트 6%대 현대백화점 5%대 상승 엔에스쇼핑 하락","BGF리테일 주가는 3.30%(4500원) 상승한 14만1천 원에, GS리테일 주가는 1.97%(700원) 높아진 3만6250원에 거래를 끝냈다. 현대홈쇼핑 주가는 1.26%(1천 원) 오른 8만400원에, GS홈쇼핑 주가는 0.72%(1천 원) 상승한..."
2654,2021-01-08,"서산시, 농특산물 '비대면 판매확대' 활로 모색","또 대형 유통매장을 보유한 CJ프레시웨이㈜,  GS리테일, 롯데마트, E마트 등 대형유통업체 발굴에도 힘쓰기로 했다. 이외도 비대면 판매 활성화를 위해 공영 또는 GS 등 국내 메이저급의 TV 홈쇼핑과 영상 스트리밍으로..."
2655,2021-01-08,"[기획] ""가치소비 확산에""...유통업계, '친환경' 탈바꿈으로 분주",GS리테일도 지난해 말 '투명 페트병 분리 배출' 캠페인을 시작했다. 25일부터 전국 공공주택에서 투명 페트병 분리배출 의무화가 시행됨에 따라 올바른 분리 배출 방법을 홍보한다는 의도다. ◇ '카페·패스트푸드점'서도...
2656,2021-01-08,신용등급 하락한 세븐일레븐 반전카드는?,"BGF리테일과 GS리테일의 편의점 부문 매출액은 각각 4조 6천억 원, 5조 2천억 원이며 영업이익은 두 회사 모두 1천억 원을 넘어섰습니다. 점포 수 경쟁에서도 밀리고 있는데요. CU의 경우 점포 수 1만 5천 개를 달성하며..."
2657,2021-01-08,"서산시, 비대면 농특산물 활로 찾는다","대형 유통매장을 보유한 CJ프레시웨이(주), GS리테일, 롯데마트, E마트 등 대형유통업체 발굴에도 힘쓰기로 했다. 비대면 판매 활성화를 위해 공영 또는 GS 등 국내 메이저급의 TV 홈쇼핑과 라이브커머스 등을 통해 지역..."
2658,2021-01-08,"서산시, 비대면 판매확대로 농특산물 활로 찾는다","또한, 대형 유통매장을 보유한 CJ프레시웨이(주), GS리테일, 롯데마트, E마트 등 대형유통업체 발굴에도 힘쓰기로 했다. 이외도 비대면 판매 활성화를 위해 공영 또는 GS 등 국내 메이저급의 TV 홈쇼핑과 라이브커머스..."
2659,2021-01-08,"서산시, 비대면 판매확대로 농특산물 활로 찾는다!","또한, 대형 유통매장을 보유한 CJ프레시웨이(주), GS리테일, 롯데마트, E마트 등 대형유통업체 발굴에도 힘쓰기로 했다.이외도 비대면 판매 활성화를 위해 공영 또는 GS 등 국내 메이저급의 TV 홈쇼핑과 라이브커머스..."
2660,2021-01-08,"서산시, 비대면 판매확대로 농특산물 활로 찾는다","또한, 대형 유통매장을 보유한 CJ프레시웨이(주), GS리테일, 롯데마트, E마트 등 대형유통업체 발굴에도 힘쓰기로 했다. 이외도 비대면 판매 활성화를 위해 공영 또는 GS 등 국내 메이저급의 TV 홈쇼핑과 라이브커머스..."
2661,2021-01-08,"경북대학교 통계학과 이병헌 석사과정생, 2020 빅콘테스트 대상 수상","혁신아이디어 분야와 데이터분석 분야의 2개 리그(퓨처스 리그, 챔피언 리그)로 열린 이번 대회는 한국정보통신진흥협회, SK텔레콤, 신한카드, 와이즈넛, GS리테일, CJ올리브네트웍스, 스포츠투아이, NS홈쇼핑이 참여해..."
2662,2021-01-11,[새 먹거리]신축년 맞아 '소' 주제 제품들 출시 연이어,"GS리테일은 편의점 GS25를 통해 '우유 소비 촉진'을 내결고 우유 아이스크림을 출시했고, 소를 주제로 한 설 선물세트도 출시했다. SPC삼립은 소가 웃고 있는 캐릭터로 유명한 치즈를 사용한 빵 제품을 내놓았다. 이밖에..."
2663,2021-01-11,"“착한 소비 동참하세요”…유통가, 낙농·수산업계 돕기 본격화",연세우유콘은 GS25의 유제품 기획 담당 부서가 우유와 유제품 소비 부진으로 힘든 시기를 겪는 낙농가를 돕기 위해 개발한 GS리테일의 프리미엄 PB ‘유어스 프리미엄’ 제품이다. GS25의 유제품 MD(상품기획자)와...
2664,2021-01-11,"[솔로이코노미 단신] 11번가, SSG닷컴 새벽배송 서비스 오픈 外","편의점 GS25, 낙농가 돕기 '우유소비 촉진' GS리테일이 운영하는 편의점 GS25가 '연세대학교 연세우유'와 손잡고 '연세우유 우유콘(이하 연세우유콘)' 아이스크림을 출시했다고 11일 밝혔다. '연세우유콘'은 GS25의 유제품..."
2665,2021-01-11,"[신상NEWS] 롯데제과, 흰 소의 해 맞아 ‘말랑이 과자선물세트’ 출시 外","[사진제공=GS리테일] ■ GS25-연세우유, 우유 함량 60% ‘연세우유 우유콘’ 출시 편의점 GS25가 ‘연세대학교 연세우유’와 손잡고 ‘연세우유 우유콘(이하 연세우유콘)’ 아이스크림을 출시했다. ‘연세우유콘’은 GS25의..."
2666,2021-01-11,"SKT·아마존 연합, SSG닷컴 통해 새벽배송 나선다",네이버는 GS리테일과 손잡고 네이버쇼핑의 장보기 서비스 내에 GS프레시몰을 입점시켜 새벽배송 서비스를 제공하고 있다. 오후 10시 30분 전까지 주문하면 다음날 아침에 받을 수 있다. 현재 서울 전역과 경기 일부...
2667,2021-01-11,SK텔레콤-아마존 연합…SSG닷컴 통해 새벽배송,네이버는 GS리테일과 손잡고 네이버쇼핑의 장보기 서비스 내에 GS프레시몰을 입점시켜 새벽배송 서비스를 제공하고 있다. 오후 10시 30분 전까지 주문하면 다음날 아침에 받을 수 있다. 현재 서울 전역과 경기 일부...
2668,2021-01-11,[브리핑] 이마트·GS25·CU·세븐일레븐·롯데하이마트,"◇GS25, ‘연세우유콘’ 출시 GS리테일은 편의점 GS25가 ‘연세우유 우유콘(이하 연세우유콘)’ 아이스크림을 출시했다고 11일 밝혔다. 연세우유콘은 GS25의 유제품 기획 담당부서가 코로나19 확산에 따라 우유와 유제품..."
2669,2021-01-11,"GS25, 낙농가 돕는 PB 제품 '연세우유콘' 출시","‘연세우유콘’은 GS25의 유제품 기획 담당부서가 개발한 GS리테일 프리미엄 PB(Private Brand, 자체브랜드) ‘유어스 프리미엄’ 제품이다. 이는 GS25의 유제품 MD(상품기획자)와 연세대학교 연세우유 제품개발..."
2670,2021-01-11,"고양시, ㈜오투아이에서‘사랑의 쌀’기부",특히 GS리테일과 업무협약으로 만든 전국 최초 기업연계형 사업인 슈퍼사업단(GS THE FRESH)에서는 코로나19로 자가격리된 시민들에게 지원하는 생활물품 등을 배달하는 택배사업단을 운영하는 등 다양한 자활사업 추진으로...
2671,2021-01-11,"GS25, ‘연세우유콘’ 출시로 우유소비 촉진‥낙농가 돕기 본격화",특징 GS리테일이 운영하는 편의점 GS25가 ‘연세대학교 연세우유’와 손잡고 ‘연세우유 우유콘(이하 연세우유콘)’ 아이스크림을 출시했다고 11일(오늘) 밝혔다. ‘연세우유콘’은 GS25의 유제품 기획 담당부서가...
2672,2021-01-12,"채식주의자는 먹을 게 적다? 식품업계, '비건' 제품 연이어 출시","GS리테일이 운영하는 편의점 GS25도 지난해 말 비건 간편식 '베지가든)매운떡볶이'와 '베지가든)짜장떡볶이'를 출시한 바 있다. 숙성 고추장과 춘장, 다시마 등을 사용한 소스에 쌀떡을 사용했다. 소스를 비롯한 모든..."
2673,2021-01-12,"GS25, 하이트진로와 협업 진로이즈백 컬래버 상품 4종 출시","GS리테일이 운영하는 편의점 GS25가 하이트진로와 손잡고 진로안주플래터, 두꺼비감자칩, 두껍면떡볶이, 두꺼비헛개껌 등 진로이즈백 협업 상품 4종을 업계 단독으로 선보입니다. 양사는 상품 콘셉트와 디자인 등을..."
2674,2021-01-12,"포항시, 대형마트와 손잡고 구룡포 과메기 판로확대 나서","12일 포항시에 따르면, 시는 타 지자체와 공동 개발 상품을 선보이는 등 지자체와의 상생 모델을 구축해 온 GS리테일과 손잡고 코로나19로 판로가 막혀 어려움을 겪고 있는 어민을 지원하기 위한 새로운 상생 모델을..."
2675,2021-01-12,"포항시, 대형마트와 손잡고 구룡포 과메기 판로확대 나서",포항시는 다른 지자체와 공동 개발 상품을 선보이는 등 지자체와의 상생 모델을 구축해 온 GS리테일과 손잡고 코로나19로 판로가 막혀 어려움을 겪고 있는 어민을 지원하기 위한 새로운 상생 모델을 제시하고 긴급지원을...
2676,2021-01-12,"포항시, 대형마트와 손잡고 구룡포 과메기 판로확대 나서","어민 긴급지원 위해 대형마트와 함께 새로운 상생 모델 제시 조인호 기자, 포항시는 타 지자체와 공동 개발 상품을 선보이는 등 지자체와의 상생 모델을 구축해 온 GS리테일과 손잡고 코로나19로 판로가 막혀 어려움을..."
2677,2021-01-12,"포항시, 과메기 판로 확보 두 팔 걷었다",이에 포항시는 타 지자체와 공동 개발 상품을 선보이는 등 지자체와의 상생 모델을 구축해 온 GS리테일과 손잡고 코로나19로 판로가 막혀 어려움을 겪고 있는 어민을 지원하기 위한 새로운 상생 모델을 제시하고...
2678,2021-01-12,"유통업계, 진로 두꺼비 앓이",GS리테일이 운영하는 GS25와 하이트진로는 ▲진로안주플래터 ▲두꺼비감자칩 ▲두껍면떡볶이 ▲두꺼비헛개껌 등 4종을 GS25 단독상품으로 출시했다. 양사는 차별화 상품 기획차원에서 이번 협업상품을 선보이게 됐고...
2679,2021-01-12,"[CES 2021] GS칼텍스가 꿈꾸는 미래 주유소, 드론 물류 가능할까?","지난해 6월 제주도에서 GS리테일, 제주특별자치도, 산업통상자원부와 함께 진행한 드론 배송 시연 행사도 소개했다. GS25 편의점의 나만의냉장고 앱을 통해 상품을 주문하면 편의점 인근 주유소에서 드론에 적재해..."
2680,2021-01-12,"포항시, 구룡포 과메기 판로 뚫었다",포항시는 타 지자체와 공동 개발 상품을 선보이는 등 지자체와의 상생 모델을 구축해 온 GS리테일과 손잡고 코로나19로 판로가 막혀 어려움을 겪고 있는 어민을 지원하기 위한 새로운 상생 모델을 제시하고 긴급지원을...
2681,2021-01-12,"GS리테일, 코로나19 및 지역 경제 침체로 어려운 구룡포 어민에게 과메기 10만...",GS리테일이 코로나19로 어려움을 겪고 있는 포항시 구룡포 어민들로부터 10만 마리 규모의 과메기를 매입해 판로 지원에 나선다고 이달 12일 밝혔다. 지난 12월 전라남도와 손잡고 공동 개발 상품을 선보이는 등...
2682,2021-01-13,"GS리테일·홈쇼핑, 청년 스타트업 5개사 제품 출시","/ⓒGS리테일 GS리테일과 GS홈쇼핑은 청년 스타트업 '달차컴퍼니'(페이크커피), '잇마플'(저염 도시락), '스위트바이오'(그릭요거트), '뉴트리그램'(단백질 바), '마돈석'(일본 가정식) 등 5개사의 제품을 출시한다고 13일..."
2683,2021-01-13,"식품유통업계, 친환경 행보 녹색소비 유도",GS리테일도 친환경 대열에 동참했다. 작년 12월 말부터 투명 페트병 분리배출시 라벨 제거를 알리고 유색 플라스틱 분리 활동으로 자원 재활용 캠페인을 펼친다. GS리테일은 투명 페트명 분리 배출 시행 정보와 올바른...
2684,2021-01-13,"GS리테일-GS홈쇼핑, 청년 혁신상품 판매 돕는다","GS리테일과 GS홈쇼핑이 손잡고 청년 스타트업 창업가에 대한 지원을 강화한다. GS리테일은 GS홈쇼핑과 함께 달차컴퍼니(페이크커피), 잇마플(저염 도시락) 등 혁신적인 5개의 청년 스타트업의 상품을 양사 판매채널에서..."
2685,2021-01-13,"GS홈쇼핑·GS리테일, 청년 스타트업 창업가 발굴 합심",GS홈쇼핑과 GS리테일이 미래 유망한 청년 스타트업 창업가들을 발굴해 동반 성장 확대에 나선다. GS홈쇼핑과 GS리테일은 △달차컴퍼니(페이크커피) △잇마플(저염 도시락) △스위트바이오(그릭요거트) △뉴트리그램...
2686,2021-01-13,"GS가 발굴한 식품 스타트업, 신제품 출시",GS리테일과 GS홈쇼핑이 식품 스타트업 발굴 및 육성 프로그램인 넥스트 푸디콘에서 선발된 스타트업과의 합작품을 13일부터 각사 매장을 통해 판매한다. 두 회사는 지난해 7월 공유주방 플랫폼 위쿡과 함께 첫 번째...
2687,2021-01-13,"'청년 스타트업 상품 날개 단다' GS리테일 X GS홈쇼핑, 미래 먹거리 발굴 프로...",뷰어스 심영범 기­자 대기업 유통사가 미래 유망한 청년 스타트업 창업가들을 발굴해 동반 성장 확대에 나선다.GS리테일이 GS홈쇼핑과 손잡고 ▲달차컴퍼니(페이크커피) ▲잇마플(저염 도시락) ▲스위트바이오...
2688,2021-01-13,"'GS홈쇼핑·리테일', 유망스타트업 ""날개 달기""","GS홈쇼핑과 GS리테일은 달차컴퍼니, 잇마플, 스위트바이오, 뉴트리그램 , 부타이 등 5개의 혁신적 청년 스타트업 상품을 양사 판매 채널을 통해 선보인다고 13일 전해왔다. 이에 양사는 GS샵, GS25, GS더프레시 일부 오프라인..."
2689,2021-01-13,"엥겔지수, 왜 20년 만에 최고치로 올랐을까…""홈이코노미 효과""",GS리테일에서 국내외 유명 유기농 상품을 전문 판매하는 모바일 앱 '달리살다'의 지난해 12월 매출은 정식 론칭시점인 2020년 10월 한달보다 2배 이상 신장했다. 또 풀무원 계열의 올가홀푸드는 친환경 국제인증인 ASC...
