,date,title,contents
1319,2020-07-03,GS25 'GS25무제한요금제' 2종 출시,김상현 GS리테일 서비스상품 담당 MD는 “GS25요금제는 합리적인 소비트렌드가 확산함에 따라 이용자들의 자발적 추천을 통해 가입자 수 15만명을 돌파하며 업계를 놀라게 한 GS25의 대표 반값 서비스 상품이다.”며...
1320,2020-07-03,"GS25,무제한 통신 요금제 2종 선봬","김상현 GS리테일 서비스상품 담당 MD는 ""GS25요금제는 합리적인 소비트렌드가 확산함에 따라 이용자들의 자발적 추천을 통해 가입자 수 15만명을 돌파하며 업계를 놀라게 한 GS25의 대표 반값 서비스 상품""이라며..."
1321,2020-07-03,"허세홍 허서홍 포함 GS 오너4세, GS 주식 9만주 더 사들여",허연수 GS리테일 대표이사 부회장의 아들 허원홍씨는 6월29일과 1일 GS 주식을 모두 5450주 장내매수했다. 허씨의 GS 지분율은 0.91%로 유지됐고 보유주식 수는 84만1183주에서 84만6633주로 늘었다. 허동수...
1322,2020-07-03,편의점서 '데이터 무제한 반값 요금제' 출시,김상현 GS리테일 서비스상품 담당 MD는 “GS25요금제는 합리적인 소비트렌드가 확산함에 따라 이용자들의 자발적 추천을 통해 가입자 수 15만명을 돌파하며 업계를 놀라게 한 GS25의 대표 반값 서비스 상품”이라며...
1323,2020-07-03,"라미화장품 박혜린 대표, '플라워 버킷 챌린지' 동참","위기를 극복하기 위해 라미화장품의 모든 임직원들과 최선의 노력을 다할 것""이라고 말했다. 박혜린 대표는 플라워 버킷 챌린지를 이어갈 다음 참가자로 GS리테일 조윤성 사장을 지명했다. 중기&amp;창업팀 komoonsoon@"
1324,2020-07-03,"유통주 대체로 상승, 현대백화점 BGF리테일 3%대 신세계 2%대 올라","BGF리테일 주가는 3.26%(4500원) 상승한 14만2500원에, GS리테일 주가는 0.27%(100원) 높아진 3만7천 원에 각각 거래를 끝냈다. GS홈쇼핑 주가는 0.18%(200원) 오른 11만2500원에 장을 마쳤다. 현대홈쇼핑 주가는 0.16..."
1325,2020-07-03,"GS 일가 허경수 코스모그룹 회장, UN빌리지 고급빌라 분양 나섰다",‘빌라 드 그리움’의 건축주는 우리나라의 세탁 문화를 바꾼 ‘하이타이 신화’의 주인공 고 허신구 전 GS리테일 명예회장의 네 자녀다. 비즈한국이 자세한 내용을 취재했다. LG그룹 창업 1세대인 고 허신구 전...
1326,2020-07-03,"""주문하신 화장품 바로갑니다""…화장품 업계도 뛰어든 배송전쟁",GS리테일의 H&amp;B 스토어인 랄라블라도 배달앱인 '요기요'와 화장품 당일 배달 서비스를 도입했다. 매장에서 판매하는 200여종에 대해 오전 11시부터 밤 10시까지 주문하면 배달해준다. 서울시내 일부 점포에서 배달 서비스를...
1327,2020-07-03,"GS25, 데이터·통화 무제한 통신 요금제 반값 시대 열어","김상현 GS리테일 서비스상품 담당 MD는 ""업계 최초로 선보이는 월 3만원대의 무제한 요금제가 코로나19 시대를 맞아 어려운 서민 경제에 합리적 소비 활력을 불어넣는 데에 도움이 됐으면 한다""고 말했다."
1328,2020-07-03,"GS25, 3만원대 음성·데이터 무제한 이용 요금제 2종 출시","김상현 GS리테일 서비스상품 담당 MD는 ""GS25요금제는 합리적인 소비 트렌드가 확산함에 따라 이용자들의 자발적 추천을 통해 가입자 수 15만 명을 돌파한 대표 반값 서비스 상품""이라며 ""월 3만 원대 무제한..."
1329,2020-07-06,경기도 공공배달앱 우선협상대상자에 'NHN페이코',"기존 배달앱 업체(먹깨비), 배달대행사(생각대로·바로고·부릉 등), POS사(판매정보관리시스템, 포스뱅크·이지포스 등), 외식·유통 프랜차이즈(제너시스비비큐·죠스떡볶이·BGF리테일·GS리테일·세븐일레븐 등) 등..."
1330,2020-07-06,국민연금의 베팅…편의점 담고 車 뺐다,152개 종목 주식보유현황 공시 GS리테일·BGF리테일 사고 호텔 등 코로나타격株는 줄여 전기車배터리 핵심소재 제조 포스코케미칼 2대 주주 등극 더블유게임즈 지분 5%P 늘려 국민연금공단이 지난달 2차전지...
1331,2020-07-06,"GS25, 폭염 취약 계층 지원을 위한 7월 한달 동안 ‘진심 해피해피’ 캠페인 ...","GS리테일이 운영하는 편의점 GS25는 7월 한 달 동안, 기상청, 행정안전부, 보건복지부, 농심등과 손을 잡고 여름 폭염 피해 예방활동으로 ‘진심 해피해피’ 캠페인을 진행한다. ‘해피해피’는 해를 피하고 해피한..."
1332,2020-07-06,1분기 살아남았다지만…GS25도 코로나 장기화 직격탄,개학 순차적 진행으로 특수입지 상권 회복 지연 여파 이른 더위로 빨리 찾아온 성수기·국내 여행 활성화는 호재 서민지 기자 vitaminji@ajunews.com 1분기 나홀로 살아남았던 GS리테일 편의점 GS25 역시 2분기에는 코로나19...
1333,2020-07-06,"GS리테일, 전라남도와 1500억 규모 MOU 체결",전남 우수 상품 판로 확대·신상품 공동 개발에 합의 GS리테일이 전라남도와 우리 농·수·축산물 소비 진작을 위한 업무 협약(MOU)을 체결했다고 최근 밝혔다. 이 회사는 앞서 고흥 주대마늘 기획전을 벌이고 완도에...
1334,2020-07-06,"셀프 빨래방 ‘런드리존’, 언택트 문화에 특화된 맞춤형 매장으로 눈길","한편, 런드리존은 GS리테일의 GS25와 업무협약을 맺어 편의점과 빨래방 공동 창업 시 다양한 혜택을 지원하는 프로모션을 진행 중이다. 런드리존과 슈슈댕은 하이마트 메가스토어 울산점 추가 입점 예정이며, 자세한..."
1335,2020-07-06,코스피 2180선 돌파…금융투자 강매수에 1.65%↑,"SK(-3.68%), 아모레퍼시픽(-2.40%), 삼성바이오로직스(-2.20%), GS리테일(-2.03%) 등은 2% 넘게 하락했다. 시가총액 1위인 삼성전자는 전 거래일 종가보다 1400원(2.61%) 오른 5만5000원에 거래를 마쳤다. 2위인..."
1336,2020-07-06,"유통주 혼조, 현대백화점 3%대 오르고 호텔신라 GS리테일 내려",편의점업체 주가를 살펴보면 BGF리테일 주가는 14만2500원에 거래를 끝내 직전 거래일과 같았다. GS리테일 주가는 2.03%(750원) 내린 3만6250원에 장을 마쳤다. [비즈니스포스트 ]
1337,2020-07-06,"GS리테일, 여에스더와 손잡고 ‘건기식 3종’ 론칭","GS리테일이 의학 박사 여에스더 씨와 함께 헬스·뷰티 차별화 건강식품 ‘에스더 포뮬러’ 3종을 선보였다. 에스더 포뮬러 3종은 유산균 시너지, 에너지 업, 석류 콜라겐 젤리다. 유산균 시너지(5g)는..."
1338,2020-07-06,"부서간 벽 허물고 협업 강화…GS, 일하는 방식·조직문화 싹 바꾼다","GS리테일은 4F(fair-올바른, friendly-친근한, fresh-신선한, fun-즐거운)의 조직 가치를 만들었다. 이런 제도가 직원, 가맹 경영주, 파트너사, 고객 모두가 가감 없이 자신의 의견을 개진할 수 있도록 홈페이지에 핫라인인..."
1339,2020-07-07,"[리포트]아동학대기획-""편의점에 신고해요"" TJB-대전경찰-GS편의점 학대 예방...","▶ 인터뷰 : 김재윤 / GS리테일 편의점사업부 - ""최근 (코로나 19로) 편의점 이용 방문객 수 증가와 택배 건수가 증가하고 있는데 저희가 또 최근 사회 이슈인 아동학대 캠페인을 이런 파급성을 감안해서 경찰청과 제안해서..."
1340,2020-07-07,"편의점, 반려동물 시장까지 노린다","앞서 지난 3월 편의점 지에스이십오(GS25)를 운영하는 GS리테일 역시 현대해상과 함께 반려동물 보험상품인 무배당 하이펫 애견보험을 출시했다. GS리테일에 따르면, 이 상품은 배상책임 및 장례비에 초점을 맞췄다...."
1341,2020-07-07,"전남도-GS리테일, 농수축산물 1500억 유통구매 협약",전남도는 최근 대형 유통업체인 ㈜GS리테일과 전남 농수축산물 1500억원 구매약정과 판매확대를 위한 업무협약을 체결했다. 최근 가진 협약식에는 김영록 전남도지사와 허연수(주)GS리테일 대표이사를...
1342,2020-07-07,"국민연금 투자한 152개 살펴보니, 키워드는 '언택트'",국민연금은 지난해 4월 기준 5.02%였던 GS리테일(GS25시 운영사)의 지분율을 6.04%로 끌어올렸다. CU의 운영사인 BGF리테일 보유 지분도 6.02%에 달한다. 코로나19로 인해 환자들이 먹는 건기식에 대한...
1343,2020-07-07,"유통주 대체로 떨어져, 현대백화점 이마트 하락 호텔신라 상승",77%(500원) 떨어진 6만4200원에 각각 거래를 끝냈다. BGF리테일 주가는 1.05%(1500원) 빠진 14만1천 원에 장을 마쳤다. 반면 GS리테일 주가는 3.45%(1250원) 오른 3만7500원에 거래를 마감했다. [비즈니스포스트 ]
1344,2020-07-07,'편의점 샛별이' 베트남서 대박…GS25 매출 30% 뛰었다,GS25를 운영하는 GS리테일은 7일 베트남 GS25의 최근 2주간(6월 23일~7월 6일) 매출이 전월 같은 기간 대비 30.5% 늘었다고 밝혔다. GS25는 편의점 샛별이가 글로벌 OTT플랫폼 아이치이(iQIYI)를 통해 베트남에서...
1345,2020-07-07,베트남 GS25 '편의점 샛별이' 덕에 호황,(사진=GS리테일) 지에스(GS)리테일이 베트남에 선보인 편의점 브랜드 GS25가 '한류 드라마' 후광을 누리는 모양새다. 7일 GS리테일은 SBS 드라마 '편의점 샛별이' 덕분에 베트남에서 GS25 인기가 치솟았다고 밝혔다....
1346,2020-07-07,'코로나 직격탄' 롯데쇼핑 신용등급 전망도 '강등',"GS리테일도 기존 등급(AA)을 유지했다. 주력 사업인 편의점이 1~2인·맞벌이 가구 증가로 호황을 맞이한 영향이 컸다. 여기에 코로나19 악재에도 점포 확장을 통한 '규모의 경제'와 구매 통합에 따른 매익률 개선, 개발 부문..."
1347,2020-07-07,"[SR유통] GS25, 편의점 샛별이 인기에 베트남 관광 명소로",베트남 현지 고객이 베트남 GS25에 설치된 편의점 샛별이 포토존에서 인증 사진을 촬영하고 있다 ⓒGS리테일 - 한국 문화 전파하는 플랫폼 될 것 GS25는 드라마 편의점 샛별이 효과가 국내를 넘어 해외까지 확대되고...
1348,2020-07-07,"베트남 GS25, ‘편의점 샛별이’ 인기 타고 매출 ‘쑥’",베트남 현지 고객이 베트남 GS25에 설치된 편의점 샛별이 촬영 부스에서 인증 사진을 촬용하고 있다.(사진=GS리테일)[이데일리 김무연 기자] GS25가 드라마 ‘편의점 샛별이’ 효과를 톡톡히 보고 있다. GS25는 베트남...
1349,2020-07-08,GS25 '혼보신족' 위한 보양식 상품 출시,"8일 GS리테일이 운영하는 편의점 GS25가 2019년 매출 데이터를 분석한 결과 냉장 간편식에서 삼계탕, 추어탕, 사골곰탕 등과 같은 보양식 관련 상품이 삼복 시즌(초복 전 10일에서 말복 이후 10일, 약 50일) 동안 매출이 연..."
1350,2020-07-08,"충청 편의점 1천500여 개, 아동학대 신고 돕는다",[김재윤/GS리테일 편의점사업부 : 최근 이슈인 아동학대 캠페인을 이런 파급성을 감안해서 경찰과 제안해서 저희 반값 택배와 함께 기획하게 됐습니다.] 경찰도 코로나19 사각지대에 놓인 아동들을 면밀하게 살피고...
1351,2020-07-08,"유통주 대체로 하락, 호텔신라 현대백화점 신세계 모두 내려",78%(500원) 낮아진 6만3700원에 각각 거래를 마감했다. BGF리테일 주가는 2.48%(3500원) 떨어진 13만7500원에 장을 마쳤다. 반면 GS리테일 주가는 0.67%(250원) 높아진 3만7750원에 거래를 끝냈다. [비즈니스포스트 ]
1352,2020-07-08,"GS25, 혼보신족 위한 ‘든든한’ 보양식 출시","GS리테일이 운영하는 편의점 GS25가 2019년 매출 데이터를 분석한 결과 냉장간편식에서 삼계탕, 추어탕, 사골곰탕 등과 같은 보양식 관련 상품이 삼복 시즌(초복 전 10일에서 말복 이후 10일, 약 50일) 동안 매출이 연 전체..."
1353,2020-07-08,"GS25, 혼보신족 위한 '든든한 시리즈' 출시","사진=GS리테일 편의점 GS25는 삼복 시즌을 맞아 혼밥, 혼술에 이어 혼보신을 찾는 고객을 위한 보양식 상품을 선보인다고 8일 밝혔다. 이날 GS25를 운영하는 GS리테일이 지난해 매출 데이터를 분석한 결과, 냉장간편식에서..."
1354,2020-07-08,"[산업지도 바꾼 M&A]⑤롯데, 유통·호텔·화학 중심 ‘빅딜’로 사업 재편","대표적으로 2010년에는 바이더웨이(2740억 원)와 GS리테일백화점 마트부문(1조3000억 원), 말레이시아 타이탄(1조5000억 원)을 인수했다. 또 롯데칠성음료는 필리핀 펩시를 1180억 원에, 롯데삼강은 파스퇴르유업을 600억..."
1355,2020-07-08,"GS25, 삼복 시즌 보양식 상품 출시","/GS리테일 GS25, 삼복 시즌 보양식 상품 출시 보양식 상품, 삼복 시즌 매출이 년 매출 중 32.2% 구성 GS25가 삼복 시즌을 맞아 언택트 소비 트렌드 속에서 혼밥, 혼술에 이어, 혼보신을 찾는 고객을 위한 보양식 상품을..."
1356,2020-07-08,"“GS리테일, 2분기 영업이익은 790억원으로 시장 기대치를 밑돌 것”",키움증권은 8일 GS리테일에 점진적인 업황 회복을 기대한다고 전했다.박상준 키움증권 연구원은 “GS리테일의 2분기 연결기준 영업이익은 전년 동기대비 3% 늘어난 790억원으로 시장 컨센서스를 하회할 것으로 전망된다”...
1357,2020-07-08,"유통업계, 코로나 이겨내고 약진하나 했더니..'부진' 거듭",GS리테일은 790억원으로 3% 높겠지만 코로나19 영향으로 줄어든 학교·학원가와 유흥업소 주변 상권의 매출이 언제 회복될 수 있을지 미지수다. 신세계의 2분기 연결기준 영업이익은 -17억원으로 전망됐다. 코로나19 이후...
1358,2020-07-08,"[유통오늘] 세븐일레븐, 지역농가돕기 프로젝트 3탄 '전남 햇감자' 판매…갤러...","GS25 보양식 상품, 삼복 시즌 매출 연 매출 중 32.2% 구성 GS리테일이 운영하는 편의점 GS25는 2019년 매출 데이터를 분석한 결과를 8일 발표했다. 그 결과, 냉장간편식에서 삼계탕, 추어탕, 사골곰탕 등과 같은 보양식 관련..."
1359,2020-07-09,[특집- 밀양시 민선 7기 2주년 점검] 나노산업·청정관광·미래농업 ‘밀양 경...,"밀양의 6차 산업은 가공, 유통, 체험까지 아우르는 농특산물 상품 개발과 판로 다변화를 위해 대형마트와 연계한 직거래를 적극 발굴했으며 쿠팡, GS리테일 등 대형유통업체와 업무협약을 체결했다. 농산물 꾸러미..."
1360,2020-07-09,"유통주 대체로 하락, 신세계 현대백화점 내리고 이마트 2%대 올라","GS리테일 주가는 2.38%(900원) 내린 3만6850원에, BGF리테일 주가는 1.45%(2천 원) 하락한 13만5500원에 거래를 끝냈다. 현대홈쇼핑 주가는 1.41%(900원) 떨어진 6만2800원에 거래를 마쳤다. 반면 GS홈쇼핑 주가는 0.74..."
1361,2020-07-09,"“GS리테일, 2분기 실적은 당초 예상대비 부진할 것으로 추정”","한화투자증권은 9일 GS리테일에 대해 2분기 실적이 시장 기대치를 하회할 것으로 보이지만, 하반기 점진적인 회복과 내년 성장성이 재점화될 것으로 보인다라고 전했다.남성현 한화투자증권 연구원은 “GS리테일 2분기..."
1362,2020-07-09,"[SR유통 새상품] 롯데제과, '젤리셔스' 이색 젤리 3종 출시 外","시그니처 치약&amp;칫솔 제품 이미지 ⓒGS리테일 ◆ GS리테일, 프리미엄 '시그니처' 치약, 칫솔 출시 - LG생활건강과 협업 GS25는 LG생활건강과 손을 잡고 '시그니처'로 기능성 치약과 칫솔을 개발해, GS리테일이 운영하는 GS25, GS..."
1363,2020-07-09,"[단독] 서울교통공사, 지하철 상가 개별입찰 전환에도 무더기 유찰","앞서 공사는 지난 2013년 '지하철 6·7호선 유휴공간 개발 계획'을 통해 상업공간의 70%를 중소상인에게 제공, 소상공인을 보호하고 계약기간을 기본 5년에서 추가로 5년 더 연장 가능한 조건으로 GS리테일과..."
1364,2020-07-09,"GS25, LG생건 손잡고 '기능성 치약·칫솔' 개발","제품은 GS리테일이 운영하는 GS25, GS THE FRESH, 랄라블라에서 이달 10일 단독 출시한다. GS25에 따르면 2020년 전년 대비 상반기(1월~6월) 위생용품 치약, 칫솔 매출 데이터를 분석한 결과 치약 카테고리는 기능성치약(특수..."
1365,2020-07-09,"한화호텔앤드리조트, 화훼농가 지원 `플라워 버킷 챌린지 캠페인` 동참","사회적 책임을 다하기 위해 최선을 다하겠다""라고 말했다. 릴레이 방식으로 진행되는 플라워 버킷 챌린지는 GS리테일(사장 조윤성)의 지명을 받아 참여하게 됐으며 다음 주자로 신세계사이먼(대표이사 조창현)을 추천했다."
1366,2020-07-09,"문석 한화 H&R 대표, '플라워 버킷 챌린지' 동참","[GS리테일 지명 받아 참가, 다음 주자로 신세계사이먼 추천] 한화호텔앤드리조트가 코로나19(COVID-19)로 인한 '사회적 거리두기'와 각종 행사 취소로 어려움을 겪는 화훼농가를 돕기 위한 '플라워 버킷 챌린지' 캠페인에..."
1367,2020-07-09,"GS리테일, LG생활건강과 손잡고 프리미엄 ‘시그니처’ 치약·칫솔 출시","GS리테일, LG생활건강과 6개월간 공동 협업 통해 프리미엄 브랜드 ‘시그니처’ 출시 GS25, GS THE FRESH, 랄라블라에서 ‘시그니처죽염치약’, ‘시그니처죽염칫솔’ 단독 판매 GS25가 생활용품 1위 기업 LG생활건강과 손을..."
1368,2020-07-09,"문석 한화H&R 대표, 화훼농가와 '함께 멀리'","의미를 되새기며 기업의 사회적 책임을 다하기 위해 최선을 다하겠다""고 밝혔다. 문 대표는 조윤성 GS리테일 대표의 지명을 받아 플라워 버킷 챌린지에 참여하게 됐다. 다음 주자론 조창현 신세계사이먼 대표를 꼽았다."
1369,2020-07-10,"GS25, 여름밤 화려하게 빛날 투톤 색감 ‘오로라 마카롱’ 선보여","GS리테일이 운영하는 편의점 GS25 디저트 상품 판매 데이터를 분석한 자료에 따르면, 디저트 상품의 전년대비 연도별 상승률이 2018년 161.7%, 2019년 125.6%, 2020년 상반기(1~6월) 246.7%의 높은 신장세를 보이고 있다. 특히..."
1370,2020-07-10,"[SR유통] 편의점업계, '혼족' 겨냥 여름맞이 '보양식' 열전","GS25 든든한 보양식 시리즈 제품 이미지 ⓒGS리테일 GS25는 올해 언택트 소비가 활성화됨에 따라 혼족을 위한 상품 구매가 높을 것으로 예상하고 보양식 인기 재료인 오리와 닭(계, 鷄)을 사용한 '든든한' 시리즈를 도시락..."
1371,2020-07-10,"한화호텔앤드리조트 문석 대표, 플라워 버킷 챌린지 동참",릴레이 방식으로 진행되는 플라워 버킷 챌린지는 조윤성 GS리테일 사장의 지명을 받아 참여하게 됐다. 한화호텔앤드리조트 문석 대표이사는 다음 주자로 신세계사이먼 조창현 대표이사를 추천했다. 한편...
1372,2020-07-10,"유통주 대체로 떨어져, BGF리테일 4%대 현대백화점 3%대 밀려","BGF리테일 주가는 4.43%(6천 원) 떨어진 12만9500원에, GS리테일 주가는 0.68%(250원) 낮아진 3만6600원에 거래를 마쳤다. 현대홈쇼핑 주가는 1.75%(1100원) 하락한 6만1700원에, GS홈쇼핑 주가는 1.73%(1900원) 내린..."
1373,2020-07-10,"서른, 잔치는 시작됐다…CU에 TKO승 GS25 [기업언박싱]",편의점시장서 발견한 7가지 숫자를 활용해 GS리테일을 언박싱(unboxing)해보기로 했다. 서프라이즈 vs 예상보다도 부진①실적.최근 편의점업계를 놀라게 만든 숫자도 마침 2와 5였다. 올해 1분기 GS리테일 편의점사업...
1374,2020-07-10,[‘코로나 사피엔스’ 시대상](3) 생활 양식-이동·접촉·공간 없는 ‘3無’ ...,GS칼텍스·리테일은 편의점과 주유소를 기반으로 한 드론 배송 시장 진출을 선언했다. 산업통상자원부는 내후년까지 총 352억원을 투입해 드론을 활용한 물류 서비스 플랫폼 구축과 실증사업을 진행한다. 3無의 삶 3...
1375,2020-07-10,"[더벨][부동산 운용사 열전]설립이후 '흑자행진' 켄달스퀘어, 해외·리츠 '광...",시장에 나왔을 당시 GS리테일이 100% 사용하고 있었고 10년간 장기 임대차 계약도 체결된 상태였다. 특히 해당 딜에서 눈길을 끈 건 출자자다. 당시 국내 물류시장에서 생소한 투자자였던 캐나다연금투자위원회(CPPIB)와...
1376,2020-07-10,[이 앱 어때?] 슬기로운 편의점 생활 제 2탄 'GS25 나만의냉장고' 어플 활용방...,"GS25 어플 통합멤버십 파헤치기 GS25 나만의냉장고 어플을 업데이트하면 GS리테일 브랜드를 통합한 멤버쉽을 한 눈에 모아 볼 수 있는데요. 편의점 GS25 뿐만 아니라 랄라블라 , GS 수퍼마켓 GS THE FRESH , GS 온라인몰 GS..."
1377,2020-07-10,"셀프 빨래방 `런드리존`, 언택트 문화에 특화된 맞춤형 매장으로 관심","한편, 런드리존은 GS리테일의 GS25와 업무협약을 맺어 편의점과 빨래방 공동 창업 시 다양한 혜택을 지원하는 프로모션을 진행 중이다. 런드리존과 슈슈댕은 하이마트 메가스토어 울산점 추가 입점 예정이다."
1378,2020-07-10,"삼시세끼 집밥에 질렸다면, 밀키트 어때요?","현재 밀키트 시장에 진출한 업체들은 CJ제일제당(쿡킷), GS리테일(심플리쿡), 동원홈푸드(맘스키트), 롯데마트(요리하다), 만개의레시피(믿고 먹는 만개의레시피 밀키트), 이마트(피코크 밀키트), 한국야쿠르트(잇츠온)..."
1379,2020-07-13,"GS25, 모바일앱으로 주류 주문하고 점포에서 찾는 서비스 내놔",GS리테일은 13일부터 편의점 GS25에서 주류 온라인 주문결제서비스인 '와인25플러스'를 선보인다고 밝혔다. GS25가 업계 최초로 주류 스마트 오더 서비스 '와인25플러스'를 내놓았다고 13일 밝혔다. GS리테일의 통합...
1380,2020-07-13,"GS25, 업계 최초 주류 스마트오더 ‘와인25플러스’ 론칭",GS리테일이 운영하는 편의점 GS25는 13일 ‘와인25플러스’를 선보였다. 와인25플러스는 GS리테일의 통합 모바일 앱인 더팝(구 ‘나만의냉장고’앱)을 통해 고객이 주류를 주문 및 결제하고 원하는 GS25 점포에서 받을 수...
1381,2020-07-13,"GS25, 주류 스마트 오더 시스템 ‘와인25플러스’ 론칭","GS리테일이 운영하는 편의점 GS25가 ‘와인25플러스’를 13일 선보였다. 와인25플러스는 GS리테일의 통합 모바일 앱인 더팝(구 ‘나만의냉장고’앱)을 통해 고객이 주류를 주문, 결제하고 원하는 GS25 점포에서 받을 수..."
1382,2020-07-13,편의점에도 ‘주류 스마트오더’ 론칭,GS리테일의 통합 모바일앱 '더팝'에서 성인인증을 거친 고객이 앱에서 주류를 결제한 후 원하는 GS25 점포를 지정해 찾아가면 구매가 최종 완료된다. 수령자가 점포에서 주류를 찾아갈 때 신분증을 추가로 확인한다....
1383,2020-07-13,"'격변기 구원투수' 허태수 GS 회장, 디지털 전환으로 부진 타개","휘발유, 경유와 최근 수요가 크게 떨어진 항공유 등 연료유 수요 회복도 하나의 관건이지만, 당분간 대폭적인 반등은 어렵다는 게 지배적인 전망이다.이를 만회할 GS건설, GS리테일 등 비(非) 정유 계열사들의 감가상각..."
1384,2020-07-13,뒷걸음치는 '편의점 쌍두마차'…실적 반등 안고 다시 달릴까,지난 5월 이마트를 제치고 유통업종 시가총액 1위에 오르기도 했던 GS리테일이 최근 고전하고 있다. 같은 편의점주인 BGF리테일 주가도 부진하다. 편의점 매출 부진과 최저임금 급등 우려가 겹친 탓이다. 13일...
1385,2020-07-13,"[김윤섭의 유통브리핑] 신동빈, 14일 롯데그룹 하반기 사장단 회의 진행 外","◆ GS25, 업계 최초 주류 스마트오더 시스템 ‘와인25플러스’ 론칭 GS리테일이 운영하는 편의점 GS25는 주류 스마트오더 시스템 ‘와인25플러스’를 13일 선보였다고 밝혔다. 와인25플러스는 GS리테일의 통합 모바일 앱인..."
1386,2020-07-13,"GS25, 업계 1호 주류 스마트오더 '와인25플러스'",GS리테일이 운영하는 편의점 GS25가 '와인25플러스'를 13일 선보였다. 와인25플러스는 GS리테일 통합 모바일 앱인 '더팝'을 통해 주류를 주문·결제하고 원하는 GS25 점포에서 받을 수 있는 편의점 업계 1호 주류 온라인...
1387,2020-07-13,"위메프-GS프레시, 뭉치니 일냈다…마트당일배송 3개월만에 ‘9배 성장’",(운영사 GS리테일)가 만나 예상을 뛰어넘는 시너지 효과를 누리고 있다. 13일 위메프에 따르면 GS프레시와 손잡고 마트마트당일배송 서비스를 선보인지 3개월만에 거래액이 9배 이상 급증한 것으로 나타났다. 6월 한달 간...
