,date,title,contents
3855,2021-06-25,"GS리테일, 백령도·연평도 해병대에 의류건조기 선물 ","편의점 지에스(GS)25 본사 GS리테일이 인천 옹진군 백령도와 연평도를 지키는 해병대원들에게 위문품을 건넸다. 24일 GS리테일에 따르면, 오진석 부사장(GS25 사업부장) 등이 23~24일 백령도·연평도 주둔 해병대를 찾아..."
3856,2021-06-25,정용진의 베팅…단숨에 이커머스 2위 기업 인수를 넘어 시장과 기회를 샀다,"합병, 1위 네이버와의 격전을 벌일 전망이다. GS리테일은 GS홈쇼핑과의 합병을 통해 온·오프라인 통합에 나서고, 전국 1만5000개 편의점과 지분을 투자한 '부릉'과 결합해 시너지를 창출하겠다는 의지를 드러냈다."
3857,2021-06-25,"한국전쟁 71주년… 유통업계, 유공자·군 장병 지원 이어져","편의점 GS25를 운영하는 GS리테일 또한 지난 23일, 24일 양일간 백령도·연평도 해병대 부대를 방문해 8500만원 상당의 LG전자 최신형 의류건조기 50대를 위문품으로 전달했다. GS리테일은 2010년부터 해군및 해병대 군 매점..."
3858,2021-06-25,[앤츠랩]얘들아 학교 가자~ 전면등교 다가오자 이 기업이 웃는다,"BGF리테일이 점주 지원책을 열심히 마련한 덕도 있지만, 라이벌 GS리테일이 ‘남혐 논란’ 등으로 삐끗한 것도 이유로 보입니다. 올해 점포수를 1000개 늘린다는 목표를 무난히 달성할 거란 전망. BGF리테일..."
3859,2021-06-25,"[유통워치] 11번가, '2021 희망쇼핑 캠페인' 2000만뷰 돌파…GS리테일, 해병대...",GS리테일이 6·25 전쟁 71주년을 맞아 백령도·연평도 해병대 부대를 방문해 의류건조기 50대를 기증했다. 롯데하이마트도 동반성장위원회가 추진한 중소 파트너사 ESG 경영 체계 구축 사업에 동참한다. 11번가 모델로...
3860,2021-06-25,"[이춘호 기자의 푸드 블로그] '집밥해결사' 밀키트, 이젠 건강식으로 즐겨요",이후 밀키트 시장이 커지자 한국야쿠르트 등 식품업계와 GS리테일과 이마트 등 유통업계까지 모두 뛰어들어 시장 선점을 노리고 있다. 최근에는 국내 1위 식품기업인 CJ제일제당이 본격적인 시장 공략에 나서 업계가...
3861,2021-06-25,반려동물 시장 급성장...이커머스·모빌리티 업계 대공세,구체적으로는 연내 네이버 장보기 서비스에 어바웃펫 입점을 통해 반려동물 서비스를 활성화하고 GS리테일 유통망을 활용해 당일 배송 서비스를 제공하겠단 계획이다. 이밖에 네이버 펫 윈도 내 어바웃펫 24시간 전문가...
3862,2021-06-28,"영등포구, GS25내일스토어 편의점 100호점 오픈","▲ 영등포지역자활센터와 GS리테일의 기업연계형 자활근로사업인 청년자립도전사업단 ‘내 일을 통한 내일 찾기’ 참여자들 (사진제공=영등포구청) 서울 영등포구(구청장 채현일)가 영등포지역자활센터, GS리테일과..."
3863,2021-06-28,"GS, ‘보톡스 1위’ 휴젤 인수 추진…허태수號 바이오 공략","지난해에는 아시아나항공, 두산인프라코어 인수에 나서는 듯 했으나, 검토 수준에 그쳤다. GS그룹은 올해 GS리테일을 통해 유통물류 브랜드 ‘부릉’을 운영하는 메쉬코리아에 소수 지분을 투자한 바 있다. jky@"
3864,2021-06-28,"[현장톡톡]""탄소중립은 에너지 절약부터""…편의점·마트 실천 나선다","탄소중립은 에너지 절약부터 냉방·광고 등으로 전기사용 많은 상업부분 에너지 절약 운동에 상업 참여 필수 GS리테일, 홈플러스 등 프렌차이즈 14개사 탄소중립 이행 위한 사회적 협약 가져 [김창섭 / 한국에너지공단..."
3865,2021-06-28,[금일 유통업계 주요기사] 화장품 등 6개업종 '갑질조사'에 나선 공정위...동...,"BGF리테일·GS리테일·이마트24 등 14개 유통·프랜차이즈 기업과 한국프랜차이즈산업협회·한국편의점산업협회·한국백화점협회 등 8개 협단체, 에너지시민연대·소비자단체협의회 등 6개 시민단체, 한국에너지공단..."
3866,2021-06-28,"[단독] 몸 사리던 GS그룹, 휴젤 인수에 '파격 베팅'",올해 들어서는 GS리테일이 부릉을 운영하는 메쉬코리아에 소수 지분을 투자한 게 전부다. 휴젤은 매각가가 2조원이 넘는 대규모 거래다. GS그룹이 과감하게 인수 결정을 내린다면 그룹의 ‘체질’이 바뀌었다는 평가를...
3867,2021-06-28,"[단독] 불 붙는 휴젤 인수전, GS도 뛰어들었다",올해 들어 GS리테일이 부릉을 운영하는 메쉬코리아에 소수 지분을 투자한 게 전부다. 휴젤의 경우 매각가가 2조원이 넘는 대규모 거래인 불확실성이 있다는 게 업계 판단이다. IB업계 관계자는 “허 회장이 과거...
3868,2021-06-28,하반기 이커머스 시장 '무한경쟁' 예고…'다크호스' 신세계에 맞설 필살기는?,이같은 흐름 속에서 GS리테일은 GS홈쇼핑과 합병을 앞두고 있다. 오프라인 유통의 강자로 자리매김한 GS리테일과 온라인 모바일 커머스에 강점을 가진 GS홈쇼핑의 합병이 성사되면 연간 거래액 15조원에 달하는 초대형 온...
3869,2021-06-28,"GS25, 건강한 식생활 위한 슬기로운 실천 식단 선보인다","GS리테일이 운영하는 편의점 GS25와 식품의약품안전처(이하 식약처)가 이달 27일, 식약처 공식 블로그와 SNS 채널을 통해 편의점에서 건강한 식사를 할 수 있도록 실천 식단을 안내했다. 가성비 만점의 한 끼 식사로..."
3870,2021-06-28,이베이 품은 신세계 맞서 이커머스 업계 새판짠다,내달 1일 GS홈쇼핑(028150)과 합병을 앞둔 GS리테일(007070)도 통합 시너지와 디지털 전환 가속화를 골자로 온·오프라인 통합 커머스 플랫폼으로 거듭나겠다는 구상이다. 11번가는 글로벌 이커머스 1위 기업인 아마존과...
3871,2021-06-28,"“균형 잡힌 식습관 중요해요” GS25, 건강한 식생활 위한 슬기로운 실천 식단...","GS리테일이 운영하는 편의점 GS25와 식품의약품안전처(이하 식약처)가 이달 27일, 식약처 공식 블로그와 SNS 채널을 통해 편의점에서 건강한 식사를 할 수 있도록 실천 식단을 안내했다. 가성비 만점의 한 끼 식사로..."
3872,2021-06-29,김해 물류센터 2곳 화재안전 점검 나서,김해동부소방서는 지난 28일 오후 김해시 상동면에 있는 쿠팡과 GS리테일 물류센터 2곳을 찾아 화재 안전관리 컨설팅을 진행했다고 밝혔다. 이날 점검에는 주태돈 김해동부소방서장이 직접 방문해 물류센터의 화재안전...
3873,2021-06-29,GS리테일 매장 유니폼 업사이클링으로 반려동물 하네스 만든다,"GS리테일은 이달 29일, 남양주 소재의 동물자유연대 온센터(동물보호센터)에서 김명종 GS리테일 전략부문장(상무), 김민희 레미디 대표이사, 윤정임 온센터장 등이 참석한 가운데 50개의 하네스(반려동물의 어깨와..."
3874,2021-06-29,"TV도, 폰도 무인판매…""눈치 안보고 구경"" 1만명 다녀갔다","GS리테일이 운영하는 편의점 GS25의 무인 점포는 지난 4월 말 기준 290여개로 지난해 같은 기간보다 110개 늘었다. BGF리테일이 운영하는 CU도 무인 점포수가 올 3월 말 기준 270개 1년 새 90개 늘었다. 무인시대 해법…""일자리..."
3875,2021-06-29,6월 30일 알림,누리집(mogef.go.kr) 참고. ◇ GS리테일(대표 허연수)은 29일 편의점 GS25와 슈퍼마켓 GS더프레시 직원들의 구형 유니폼으로 만든 반려동물용 가슴줄(하네스) 50개를 유기견 보호센터인 동물자유연대 온센터에 기부했다.
3876,2021-06-29,"GS리테일, 헌 유니폼 새활용해 동물보호 실천",29일 경기 남양주시 동물자유연대 온센터를 찾아 반려동물 가슴줄 50개를 기부한 김명종 GS리테일 전략부문장(오른쪽 첫째)과 김민희 레미디 대표이사(왼쪽 둘째)가 윤정임 온센터장(가운데)이 기념사진을 찍고 있다....
3877,2021-06-29,"""바이오도 신사업 후보군""…체질개선 나선 허태수號 GS그룹","GS그룹 차원에서의 GS칼텍스 사업 의존도가 여전히 높다는 의미다.GS그룹은 정유업 외에도 유통사업을 영위하고 있는데, 다음달 GS홈쇼핑과 GS리테일을 합병시키는 작업을 단행하기로 한 바 있다. GS홈쇼핑과 GS리테일이..."
3878,2021-06-29,"GS리테일 지속가능경영보고서 첫 발간, “고객 및 주주와 소통 강화”",GS리테일은 지속가능경영의 성과와 비전을 담은 'GS리테일 2020 지속가능경영보고서'를 발간했다. GS리테일이 첫 지속가능경영보고서를 펴냈다. GS리테일은 지속가능경영의 성과와 비전을 담은 'GS리테일 2020...
3879,2021-06-29,"ESG경영 강화 편의점 업계, '그린슈머' 마음 사로잡을까",사진=GS리테일 GS25를 운영하는 GS리테일은 '업사이클링' 방식을 택했다. GS리테일은 GS25와 GS더프레시의 직원들이 입던 유니폼을 업사이클링 해 반려동물의 하네스로 만들어 동물자유연대 온센터에 기부했다....
3880,2021-06-29,[김윤섭의 유통브리핑] 야놀자 신규법인 ‘야놀자클라우드’ 출범 外,"GS리테일이 ‘지속가능경영보고서’를 발간하며 확고한 ESG경영 체계 구축에 나섰다. 스타벅스코리아가 50만 고객과 만든 ‘바밀카쿠 프라푸치노’를 한정판매한다. ◆ 야놀자, 슈퍼앱 전환 박차...신규 법인 ‘야놀자..."
3881,2021-06-29,집게손가락 논란 정리: 언론이 부추긴 허구의 혐오,한 누리꾼이 조윤성 GS리테일 대표에게 보낸 문자를 5월 2일 온라인 커뮤니티에 공개한 내용 그대로 기사화한 것으로 “A씨는 해당 문자메시지가 조윤성 대표 본인과 주고받은 것임을 확인시키기 위해 그의 프로필...
3882,2021-06-30,"통합 GS리테일 출범...5년간 디지털 커머스, 인프라 구축 등 1조원 투자","연간 취급액 15.5조원, 영업이익은 4000여억원으로 주요 국내 상장 유통사 최고 수준 헬로티 김진희 기자 | 편의점, 슈퍼마켓, 온라인 몰, 홈쇼핑 사업을 영위하는 통합 GS리테일호가 7월 1일 닻을 올린다. 통합 법인..."
3883,2021-06-30,온·오프 통합 GS리테일 1일 출범…'e커머스 공룡' 될 수 있을까,"편의점과 슈퍼마켓, TV홈쇼핑과 모바일 커머스를 결합한 통합 GS리테일이 출범한다. 온·오프라인 융합으로 덩치를 키우고 물류 시너지를 끌어내 종합 유통사로 거듭나겠다는 구상이다. 업계에선 이베이코리아, 요기요..."
3884,2021-06-30,‘통합 GS리테일’ 출범…“융합 커머스 탄생”,"편의점, 슈퍼마켓, 온라인 몰, 홈쇼핑 사업을 영위하는 ‘통합 GS리테일’이 내일 닻을 올립니다.GS리테일은 통합 법인 △1만5,000여 오프라인 근거리 소매점 △10여개의 디지털 커머스 △취급액 1위의 TV홈쇼핑..."
3885,2021-06-30,"'이커머스 GS' 출범, 라스트마일에 달렸다",새로운 '유통 공룡'으로 떠오를 통합 GS리테일(007070) 출범이 하루 앞으로 다가온 가운데 업계 내 긴장감이 감돌고 있다. 편의점과 홈쇼핑 사업을 주축으로 하던 양 사의 결합인만큼 오프라인과 온라인을 양 대 축으로...
3886,2021-06-30,"허연수, GS리테일 대표 ""온‧오프 통합, 차별화 고객가치 제공""",다음달 1일 GS리테일과 GS샵이 통합한 GS리테일이 출범한다. ⓒ시사포커스DB GS리테일이 GS샵과 통합하고 종합유통회사로 탈바꿈한 통합 GS리테일이 다음달 1일 출범한다. 30일 유통업계 등에 따르면 GS리테일통합에...
3887,2021-06-30,온·오프라인 경계 허문 ‘통합’ GS리테일…‘유통 메기’될까,"'통합' GS리테일이 첫 걸음을 내딛는다. 연간 매출액 10조원, 시가총액 3조8000억원 규모의 초대형 유통업체로 거듭난 GS리테일은 온·오프라인의 경계를 허물어 유통가에 새 바람을 일으킨다는 각오다. 업계에서는..."
3888,2021-06-30,온·오프·방송 통합 커머스 GS리테일 탄생,"편의점, 슈퍼마켓, 온라인몰, TV홈쇼핑 사업을 영위하는 통합 GS리테일이 7월 1일 출범한다. 통합법인 출범으로 1만5000여 오프라인 근거리 소매점, TV홈쇼핑, 전국 60여 물류센터망을 보유한 종합 유통 회사로..."
3889,2021-06-30,"유통주 하락 많아, BGF리테일 3%대 내리고 GS리테일 2%대 올라","반면 GS리테일 주가는 전날보다 2.52%(950원) 상승한 3만8650원에 거래를 끝냈다. 광주신세계 주가는 0.51%(1천 원) 오른 19만6500원에, 호텔신라 우선주 주가는 0.22%(200원) 높아진 3만8650원에 장을 마감했다...."
3890,2021-06-30,통합 GS리테일 출범...온·오프·방송 융합 커머스,"편의점, 슈퍼마켓, 온라인 몰, 홈쇼핑 사업을 영위하는 통합 GS리테일호가 출범한다. GS리테일은 7월1일 통합 법인 출범으로 1만5000여 오프라인 근거리 소매점과 10여개의 디지털 커머스, 취급액 1위의 TV홈쇼핑, 60여..."
3891,2021-06-30,"[금일 유통업계 주요기사] ""1만 5천 점포·홈쇼핑 결합"" GS리테일 내달 출범....",GS리테일이 GS홈쇼핑을 흡수 합병한 '통합 GS리테일'이 예정대로 내달 1일 출범한다. 배달 앱 2위 요기요 인수전이 유통 대기업들이 빠진 사모펀드만의 리그로 진행되는 모습이다. 무함마드 빈 살만 사우디아라비아...
3892,2021-07-01,"GS25, 스마트오더 서비스로 전통주를 똑똑하게 구매한다","GS리테일은 ""스마트오더를 통한 전통주 판매 매출이 기대 이상으로 늘어나고 있고 진열장 공간의 한계도 없이 다양한 전통주 제품을 소비자에게 선보여 전통주 산업 발전을 위해 조금이나마 이바지할 수 있어서 뜻깊게..."
3893,2021-07-01,"GS리테일, 김호성 신임 대표이사 선임",각자 대표 체제로 전환 송종호 기자 sunshine@ajunews.com GS리테일은 1일 이사회를 열어 대표이사에 김호성 GS홈쇼핑 대표이사를 선임했다.이에 따라 GS리테일은 허연수 대표이사와 함께 각자대표 체제로 전환했다. 김...
3894,2021-07-01,7월 2일 인사,대표이사 주희석 오경석 메디톡스벤처투자 △대표이사 신효진 ⊙ 한국베링거인겔하임 △사장 마틴 커콜 ⊙ 두산로보틱스 △대표이사 류정훈 ⊙ GS리테일 △대표이사 김호성 ⊙ 이뮨온시아 △대표이사 김흥태
3895,2021-07-01,김호성 신임 GS리테일 대표이사 선임,"GS리테일은 1일 이사회를 열고 김호성 대표이사를 선임했다고 밝혔다. 통합 GS리테일 출범에 따라 업무 전문성을 높이기 위한 개편으로, 허 대표는 사업 전반의 운영을 총괄하고, 김 대표는 홈쇼핑 사업 부문의 컨트롤..."
3896,2021-07-01,장 마감 후 기업공시[7월 1일],"▲현대차(005380)=6월 35만 4,409대 차량 판매해 전년 동기 대비 14.4% 증가 ▲기아(000270)=6월 25만 3,592대 판매해 전년 동기 대비 20.2% 늘어 ▲GS리테일=김호성 대표이사 신규 선임으로 허연수·김호성 각자 대표 운영..."
3897,2021-07-01,GS리테일 김호성 신임 대표이사 선임…각자대표 체제 전환,"GS리테일은 1일 이사회를 열어 대표이사에 김호성 GS홈쇼핑 대표를 선임했다. 이에 따라 GS리테일은 허연수 대표와 함께 각자대표 체제로 전환했다. 김 대표는 2003년 GS홈쇼핑에 입사해 금융·서비스부문장, 상무, 전무..."
3898,2021-07-01,또 다시 ‘속도’ 전쟁…GS리테일 “2시간 안에 배달”,"이런 가운데 편의점과 슈퍼마켓, 홈쇼핑 사업을 아우르는 통합 GS리테일이 출범했는데요. 2시간 내 배송을 승부수로 띄웠습니다. 쿠팡 로켓배송을 겨냥한 것으로 풀이됩니다. 김기송 기자입니다. [기자] 휴대폰 앱을 켜서..."
3899,2021-07-01,"GS리테일, 김호성 신임 대표 선임…허연수 대표와 각자대표 체제",GS리테일은 1일 이사회를 열고 신임 대표이사에 김호성 GS홈쇼핑 대표를 선임했다. 이에 따라 GS리테일은 기존 허연수 대표와 함께 각자대표 체제로 전환한다. 김 대표는 2003년 GS홈쇼핑에 입사해 금융·서비스부문장...
3900,2021-07-01,티몬 상장 난항...장윤석 대표 라이브커머스로 성장성 증명할까?,"신세계는 이베이코리아를 인수하며 업계 2위로 올라섰고, GS리테일은 GS홈쇼핑을 흡수합병하며 전열을 가다듬었다. 외형 확대가 시급한 티몬은 지난 4월 판매수수료 -1% 정책을 도입했다. 파트너사가 판매상품을 추가 옵션..."
3901,2021-07-01,"GS리테일, 허연수ㆍ김호성 각자대표 체제로 변경",GS리테일이이사회를 열고 대표이사에 김호성 GS홈쇼핑 대표이사를 선임했다.이에 따라 GS리테일은 허연수 대표이사와 함께 각자대표 체제로 전환했다. 1일 GS리테일에 따르면 김 대표는 2003년 GS홈쇼핑에 입사해...
3902,2021-07-02,LG→LX 사명 변경 완료... LG 독립 '빅4'는?,"◆아워홈, 구본성 전 대표 집유 확정으로 구지은 신임 대표 선임 아워홈은 2000년 LG유통(현 GS리테일) 식품서비스부문이 분리 독립하면서 설립된 식품회사다. 주력 사업은 식자재 유통 및 단체 급식이다. 구인회..."
3903,2021-07-02,"통합 GS리테일, 스타트업 육성 프로그램 ‘넥스트 푸디콘’ 결실 맺었다","1년간 진행된 육성 프로그램·테스트 판매 거친 ‘푸디콘 FAKE검정보리라떼’ ‘푸디콘 솔직단백에너지바 2종’ 7월 중순부터 도시락, 밀키트, HMR 등 추가로 선보인다 통합 GS리테일이 스타트업 육성 프로그램 ‘넥스트..."
3904,2021-07-02,"유통주 거의 다 하락, 현대홈쇼핑 2%대 BGF리테일 1%대 빠져","BGF리테일 주가는 1.18%(2천 원) 내린 16만8천 원에, GS리테일 주가는 0.66%(250원) 빠진 4만7550원에 거래를 마쳤다. 이마트 주가는 0.63%(1천 원) 낮아진 15만8천 원에, 엔에스쇼핑 주가는 0.35%(50원) 내린..."
3905,2021-07-02,유통업계 오너 ‘아이돌그룹’ 결성한다면…신동빈·정용진 역할은?,그룹을 결성할 멤버 후보군으로는 △신동빈 롯데그룹 회장△이재현 CJ그룹 회장△정용진 신세계그룹 부회장△정지선 현대백화점그룹 회장△허연수 GS리테일 대표△김범석 쿠팡 의장(이상 순서는 무작위)을 선정했다....
3906,2021-07-02,"프레시코드, GS25 편의점 '프코스팟' 서울 전 지역 400개로 확대","프레시코드는 작년 4월부터 GS리테일, GS네트웍스와 협업을 통해 GS25 편의점 내에 프코스팟 운영을 시작했다. GS25에서 운영하는 냉장택배 무인 보관함 BOX25(박스25)에 프레시코드의 샐러드와 건강 간편식을 배송하는..."
3907,2021-07-02,[MTN현장+] 달아오르는 유통가 '덩치' 경쟁…'규모' 보다 중요한 '변화',"2일 유통업계에 따르면 GS리테일이 GS홈쇼핑과 합병하면서 주요 유통 상장사 가운데 매출 규모 3위 기업으로 등극했다. 지난해 기준 GS리테일과 GS홈쇼핑의 연간 매출액 합은 총 10조원 규모로 이마트(22조원), 롯데쇼핑..."
3908,2021-07-02,"[단독] 출입구 멀고 경사에 차단봉까지...GS타임즈, '엉망진창' 장애인 전용 ...","GS리테일이 50%, 파크24가 50% 지분을 보유중이다. 제보에 따르면 합정동 IH빌딩 주차장 장애인 전용 주차구역이 사실상 사용할 수 없는 상태인 것으로 나타났다. 일반적인 장애인 전용 주차구역이 장애인들의 동선을..."
3909,2021-07-02,"편의점 3사, 필(必)환경으로 MZ세대 잡기",GS리테일은 지난 29일 지속가능경영보고서를 처음 발간하며 “ESG경영을 강화하겠다”고 말했다. GS리테일은 ‘Green Life Together’을 슬로건으로 친환경 점포를 늘리고 신재생 에너지에 중점을 두는 등 탄소 배출 감소에...
3910,2021-07-02,GS25 스마트오더 시스템 '더팝' 전통주 활성화 캠페인,"이번 스마트오더 전통주 프로모션 행사를 준비한 GS리테일은 ""작년 9월부터 스마트오더로 전통주 제품을 서비스하고 있고 지속적으로 신규 제품을 입점시키고 있다. 스마트오더를 통한 전통주 판매 매출도 기대..."
3911,2021-07-02,하반기 식품‧유통 수장 선임 분주,하반기에 들어서면서 농심은 신동원(좌) 회장이 선임되면서 56년만에 2세 경영체제에 돌입했고 GS리테일은 통합법인이 출범했지만 흡수합병된 GS홈쇼핑 대표를 GS리테일 대표에 선임해 각자 대표 체제로 전환했다....
3912,2021-07-05,"GS리테일, ESG 경영 강화...농림축산식품 펀드 투자","지역의 우수한 기업을 발굴하고, 다양한 투자 지원과 판로 개척을 확대해 ESG 경영 강화에 매진할 것 헬로티 김진희 기자 | GS리테일이 현대기술투자가 운용하는 ‘현대-GS리테일 Agro-Bio 3호 펀드’(이하 펀드)에..."
3913,2021-07-05,"GS25, '통민물장어덮밥' 출시","또 치킨을 선호하는 MZ세대(밀레니얼+Z세대)를 위해 초복(10일~12일), 중복(20일~22일)기간에 맞춰 ‘쏜살치킨’을 반값에 판매하는 행사도 진행한다는 계획이다.문지원 GS리테일 도시락 MD는 “신종 코로나바이러스..."
3914,2021-07-05,"GS25, '통민물장어덮밥' 출시",GS리테일이 운영하는 GS25가 오는 11일 초복을 맞아 프리미엄 보양 도시락 '통민물장어구이덮밥'을 오는 6일 출시한다. GS25는 표고버섯 밥 위에 특제 간장 양념을 발라 구워 낸 민물장어 한 마리를 통째로 올리고 장어...
3915,2021-07-05,"GS25, '통민물장어덮밥' 출시…""삼복더위 이겨내요""",GS리테일이 운영하는 GS25는 오는 11일 초복을 맞아 프리미엄 보양 도시락 ‘통민물장어구이덮밥’을 이달 6일 출시한다. 간편 보양식 선호 트렌드가 반영된 보양 도시락 상품이다. GS25는 표고버섯 밥 위에 특제 간장...
3916,2021-07-05,[5일 유통가 신제품] GS25·빙그레·롯데푸드·오리온·SPC그룹,사진=각 사 [아시아타임즈=변윤재 기자] GS리테일이 운영하는 GS25는 보양 도시락인 ‘통민물장어구이덮밥’을 출시한다. 빙그레는 RTD 커피 브랜드 아카페라의 신제품 ‘아카페라 스페셜티 컵’을 선보인다. 롯데푸드의...
3917,2021-07-05,"유통업계, '초복' 앞두고 '보양식' 잇달아 선보여",GS리테일이 운영하는 GS25는프리미엄 보양 도시락 '통민물장어구이덮밥'을 오는 6일 출시한다. 간편 보양식 선호 트렌드가 반영된 보양 도시락 상품이다. 표고버섯 밥 위에 특제 간장 양념을 발라 구워 낸 민물장어 한...
3918,2021-07-05,[DD 퇴근길] '게임 셧다운제' 논란 지속…재조명된 청와대 마인크래프트 영상,현대백화점이나 통합GS리테일 등 오프라인 유통기업들도 온라인 배송서비스로 컬리 자리를 넘보고 있습니다. 마켓컬리는 지난 3월 연내 상장을 목표로 한다고 밝혔는데요. 매력적인 기업임을 보여주려면 확실한...
3919,2021-07-05,"[스타트업 육성] ①유통업계, 스타트업 '멘토'로 함께 뛰자","GS리테일, '넥스트 푸디콘' 통한 신제품 출시 넥스트 푸디콘, 스타트업 발굴·지원 프로젝트 아이디어 발굴·상생 목적에 스타트업 지원 증가세 문은주 기자 joo0714@ajunews.com [사진=GS리테일 제공] #이달부터 GS리테일은..."
3920,2021-07-05,"[오늘Who] GS리테일 퀵커머스 키운다, 허연수 점포 1만5천 곳 자산",허연수 GS리테일 대표이사 부회장이 통합 GS리테일의 새 먹거리를 퀵커머스(즉시배송)에서 찾는다. 허 부회장은 편의점과 슈퍼 등 1만5천여 개 GS리테일 점포를 배송기지로 삼아 커지고 있는 퀵커머스시장을 장악해 나갈...
3921,2021-07-05,"GS25, 초복 맞아 '통민물장어덮밥' 출시","문지원 GS리테일 도시락 MD는 ""코로나와 무더위에 지친 국민의 기력 충전을 돕기 위해 보양식 상품과 행사를 선보이게 됐다""며 ""간편 보양식을 선호하는 트렌드를 반영해 보양 도시락, 보양 HMR을 핵심 상품으로..."
3922,2021-07-06,[유통 단신] 파리바게뜨·BBQ치킨·스타벅스·해태 外,"(사진=GS25) GS25, 밀리터리 프로그램 '강철부대' 컬래버레이션 상품 출시 GS리테일이 운영하는 편의점 GS25는 7월 8일부터 인기 리얼리티 밀리터리 프로그램 '강철부대'와 손을 잡고 이색 상품을 순차적으로 출시한다고..."
